"ID", "SAFENET ID", "Iteration", "Event Start Date", "Event Stop Date", "Incident Name", "Incident Number", "Event State", "Event Jurisdiction", "Event Local Unit", "Event Position Title", "Event Task", "Event Management Level", "Event Resources", "Event Incident Type", "Event Incident Activity", "Event Incident Stage", "Contributing Factors", "Human Factors", "Other Factors", "Narrative", "Immediate Action Taken", "SAFENET Create Date"
"24670","6EAK8QSFIR","2","06/20/2005 12:05"," ","MIRACLE FIRE","#061","AZ","BIA","Ft. Apache Agency","Prevention / Investigator","Initial Attack","3","Forestry","Wildland;","Line;","Initial Attack;","Communications;Equipment;","","","I have worked with the Fort Apache Hotshot crew for 21 years and always took for granted our radios.  But, within the past year I have noticed the importance of communication by radio, not only for the forces on the fire but those who may have to join the incident. I had to communicate by phone to dispatch. This lack of communication did cause confusion of who was the IC of the fire and this misunderstanding.","No narrow band until all errors of this system are corrected.","07/14/2005 00:00"
"24636","6DMNSTSAFE","2","06/18/2005 06:00"," ","WHITTEN CREEK","MT-MCD-000017","MT","BLM","Miles City","Type 2 Crew","Initial Attack","4","Crew","Wildland;","Transport to/from;","Initial Attack;Mop Up;","Human Factors;","Decision Making;","Lack of current red cards","On 6-23-05, Billings Dispatch Center (BDC) was informed by Northern Cheyenne Agency (NCA) Dispatch Center that they had sent a Type 2 crew to the Whitten Creek incident without valid red cards. NCA Dispatch Center advised that they sent the crew because the fire was less than a mile from the NCA boundary. This was brought up due to the fact that BDC was looking to see if NCA had a crew to go to a fire on Miles City District today and NCA Dispatch Center was asking if they could send the same crew members. When we asked if there was some kind of problem, NCA Dispatch Center advised us about the Whitten Creek incident.","After finding out about this incident, we suggested to MT-NCAC that they not send out any crews without the proper red cards. It shouldn't matter if the fire is threatening or actually on your land, we should not be sending anyone out without valid red cards.    We advised NCA Dispatch Center that we would not place the crew order to them and that we would show on our status board that NCA would not have any crews until we were advised that all the red cards had been signed and given out. NCA Dispatch Center asked that if they could just hand write the new dates on the old red cards for this new order and we advised him that his FMO would have to get the approval from Miles City's FMO. We were advised about 30 minutes later that Miles City FMO refused the request. MT-NCA needs to get a computer system in their dispatch center that is not on a dial up. The process that NCA has to use to work in IQCS and ROSS is extremely slow.","06/23/2005 00:00"
"24631","6DDKPUSAFE","2","06/14/2005 18:05"," ","RADIO COMMUNICATION","","OR","USFS","EICC","Dispatcher","Dispatching","5","Overhead Personnal","All Risk;","Support;","Non-incident;","Communications;","Decision Making;","","At 1800 on 6/14/2005 I was performing our normal radio checks with LCC (Lane County Sheriff’s Dept) our after hours radio service. We had 2 employees who would be out in the field that evening and would need radio coverage in case of an emergency.

LCC was unable to receive our transmission on all repeaters. We were able to receive LCC and we were able to transmit and receive to the field. I requested that LCC adjust their volume controls. LCC said they could see the receiving indicator on the radio monitor but could not hear us or anyone in the field.

I called the End User Support Center (EUSC) at 1805 on 06/15. I explained the problem and was given a ticket number (#1601604). I explained to them this was a high level emergency and a high priority.

We waited approximately 1/2 hour for EUSC to call us back then started leaving messages with our local Radio Manager. Unable to reach our local Radio Manager we called a local radio tech at home. Our local radio tech asked that we have LCC ask their radio tech to come in a look at the problem. Our local radio tech said he would come to the office to see what he could do.

At 1900 I called LCC to discuss their availability of a radio tech and to do another radio check. At that time all channels received and transmitted properly.

I contacted our local radio tech to disregard and called EUSC to tell them to lower the priority but to leave the ticket open as we were not sure if the problem was resolved. EUSC indicated that 'priority one' or 'emergency' requests for radio repair were not treated any different than any other service call.

Our local Radio Manager called at 0800 6/15/2005 to follow up on the ticket.","Employee's out in the field including fire crews and aviation resources require an immediate response to communications issues and radio system repairs. The response from EUSC is not timely or immediate and will impact safe field operations. This is not the first time we have had problems with EUSC and receiving a timely response for emergency radio system repairs. We want to bring this to the attention of management so that the situation will be resolved.    We need a direct contact list for emergency radio repairs. EUSC is not an efficient or effective means to handle these problems.","06/15/2005 00:00"
"24632","6DJJUCSAFE","2","06/14/2005 16:00"," ","FLASE ALARM","","WY","BLM","rock springs","Individuals","Fire Suppression","4","Engines","Wildland;","Line;","Initial Attack;","Human Factors;","Decision Making;Leadership;","","A smoke was reported and two engines were responded by the FOS. The smoke was reported in a timbered area of the office. Two engines were sent. The first with only a trainee Engine Operator and 2 firefighters. The second with an Engine Operator and 2 fire fighters. The second engine was supposed to shadow the first engine with the trainee Operator. A fully qualified engine operator who was supervising the trainee engine was left at base under direction of the FOS. We feel this was an unsafe decision and poor leadership direction by the FOS. The only qualified person on the fire would have been the IC, supervised his own engine, and supervised and mentored the Trainee and second engine. The potential of this situation and the multiple roles required of the qualified operator left all personnel in an unsafe position.","The qualified engine operator should have been sent out with his engine to mentor the trainee. This would have allowed adequate qualified supervision on both engines.","06/20/2005 00:00"
"24629","6DAVRWSAFE","2","06/12/2005 15:25"," ","CAMPFIRE","NM-GNF-036","NM","USFS","","Afmo","","5","Engine 736","Wildland;","Support;","Initial Attack;","Communications;","Decision Making;","SAFETY DUE TO NO COMMUNICATIONS","RESPONDING TO A FIRE AND DISPATCH HAD NO COMMUNICATION WITH AN ENGINE.

SAME ENGINE HAD SAME PROBLEMS LAST WEEK AND RADIO SHOP SUPPOSEDLY FIX THE PROBLEM BUT STILL NOT TRANSMITTING OR RECEIVING","","06/12/2005 00:00"
"24630","6DC2ZKSAFE","2","06/12/2005 10:30"," ","NOT YET AN INCIDENT","","AZ","USFS","","Ia Dispatcher","Using Dispatch Radio","1","All Field Units, Aircraft, Dispatchers","Prescribed/Fuels Treatment;Fuel Treatment;Work Capacity Test;All Risk;Wildland Fire Use;","Line;Support;Transport to/from;","Other;","Communications;Equipment;Environmental;Human Factors;Other;","Decision Making;Leadership;Risk Assessment;Performance;Situational Awareness;","installation of PART of new radio/microwave system","(1)As you may or may not know, we have been having some radio problems here on the Apache-Sitgreaves NF. The MOST CRITICAL one from my perspective as a dispatcher is that, in dispatch, we are not able to access any repeater consistently. This is, of course, a major SAFETY issue for us and people in the field, to say nothing of being a major irritation. For example when I came to work 6/11, I tried hitting each repeater and these are the results. I made several tries each.

YES, I hit the repeater:		No, I could not hit the repeater:

Chev Butte				Gentry

Greens-Sitgreaves			Promontory

Juniper Ridge		 		Lake Mtn.

Rose Peak				Big Lake

Escudilla				Saddle Mtn.

South Mtn.				Bear

Mitchell Peak

And all this will change in 10 seconds and/or 5 minutes and/or this afternoon. The NOs may become YESs and the YESs may become NOs. You never know. We have 'tickets” in for these radio problems and other radio problems. My earliest ticket that was about not being able to access a repeater consistently was dated 6/3/2005. On 6/11, ignition started on the Mesa RX (planned) burn on Clifton District. We knew we may not be able to talk to it, so there was a human repeater at the district office. Another dispatcher had to read a SPOT forecast several times to the Mesa RX off Mitchell Peak repeater before she could get a squelch tail. So what happens if/when we get a fire/accident and we are unable to talk to it at a CRITICAL time/ didn't know we needed a human repeater somewhere in advance??

When is this CRITICAL enough to actually get the radio system fixed?

(2) Several times during the last 2 weeks, we have been reading the weather (simul-select/ Greens Peak) and hear our voice coming back over on Flight Following/ once we could hear a Tonto NF dispatchers voice/reading the weather bleeding over on Flight Following along with mine.

(3) On 6/12 H-306 had been flight-following with Flagstaff Zone and called us about 1230 when they were about 5 miles out of from here, Springerville. Later the manager told we were very weak/could hardly understand us but Flagstaff Zone was still coming in loud and clear over flight- following in the helicopter radio. A Flagstaff dispatcher called us to say we were coming in over their flight-following weak and unclear. We always hear Flag Zone or Tucson loud and clear over flight-following.

(4) Yesterday we had the recon plane, 39Q, up. Several times the AA would say something to dispatch. The aircraft dispatcher would reply (off Apache-Greens or Sitgreaves-Greens) and the AA would say 'dispatch did you copy?' She would reply 'copy 39Q' Again 'dispatch did you copy?' Eventually she could actually transmit and he would hear her.

(5) Blah blah blah","FIX THE RADIO/MICROWAVE SYSTEM - GET SOMEONE WHO CAN

Possibly, if other forests are looking to get their radio/microwave systems replaced, they might, at least, want to wait until all the parts/software are there before they begin installation. Of course (?)

they might want to see how/when/if this works out on the Apache- Sitgreaves NF (and on the Santa Fe NF I guess) before they contract for something. Also why pay for something until it's completed. Why would a contractor come back??    We in dispatch can and do REPEAT THINGS OVER AND OVER AND OVER, like the weather, like 'copy', like 'yes, dispatch copies' until we get a squelch tail.

We can and do keep lookouts up, arrange for other human repeaters.

We (others in Dispatch as well as myself) have filed tickets, talked repeatedly to the Comm Spec here, talked repeatedly to the NICS people/ contractors who installed PART of the new microwave/radio system a few weeks ago (we were told they would install some software next FALL!!!), and reported all this to fire/field personnel and fire supervisors.

Basically there is nothing dispatchers can do to fix the radio system except CONTINUE TO FILE TICKETS AND SAFENETS and let everyone know what is going on so we all can function safely at some level. I am going to do a repeater check every morning and will file a new SAFENET as needed. This morning when I checked, I could hit 3 repeaters 'all' the time, 4 about 50% of the time, and 6 not at all. This afternoon I can hit some repeaters I couldn't 5 hrs ago. Blah blah blah","06/13/2005 00:00"
"24627","6DASBPSAFE","2","06/08/2005 00:00"," ","LION DEN RX","GA02","NM","FWS","San Andreas","Ignitions Trainee T2","Ignitions","3","One Task Force","Prescribed/Fuels Treatment;","Line;","Other;","Communications;","","","The use of Racal radios throughout the operational periods made communications between adjoining forces real difficult. Sometimes I was able to talk to individuals and pick them up right away and other times it took several times/tries to get that person up on the radio. At times that individual could only be several hundred yards away and we were having a difficult time talking to each other without having to move to a different location. At times there was one or two people standing next to me with the same radios and they were not picking up all or just parts of a transmission between myself and someone else.","Switch back to BK radios or start using the new digital BK's because there has not been as many communication issues with them as there has been with Racals.    I have tried to understand them better and use them every oppotunity I get for the past year or two.","06/12/2005 00:00"
"24628","6DASCJSAFE","2","06/08/2005 00:00"," ","LION DIN RX","GA02","NM","FWS","San Andres","Rxi2","Ignitions","2","Engines, Igniters, Taskforce","Prescribed/Fuels Treatment;","Line;","Other;","Communications;","","","1. We were not able to hear all communications even within 10 feet of each other.

2. You could be standing next to someone transmitting and only get half of traffic transmitted.

The Racal 7.0 version is not a safe working radio. It is a safety issue that is ongoing","We have a digital BK as a test radio. We have not experienced any of these problems with it. If possible, change to the BK. We know they work, it has been proven.    We have been working with the Racal for two years now and the problems are ongoing. This is a big safety concern...","06/12/2005 00:00"
"24633","6DJT8SSFIR","2","06/07/2005 12:00"," ","","","AZ","USFS","Peaks District","Forest Protection Officer","Fire Prevention Patrol / Forest Patrol","5","","Wildland;","Readiness/Preparedness;","Non-incident;","Communications;Equipment;","","","While patrolling north of the San Francisco Peaks on Forest Road 416 I attempted to reach Flagstaff Dispatch for a routine radio check. Radio contact could not be made by using either the primary 'Fire Net' Channel (Ch. 1) or by using surrounding Fire Net repeaters. This area is currently blind to radio communication with Flagstaff Dispatch and should be noted as a potential hazard area. Recommend using a third party for relay if emergency communication is needed.","Reported, none yet correction.","06/08/2005 00:00"
"24656","6E3PVHSAFE","2","06/01/2005 09:30"," ","TRAINING SIMULATION","N/A","OR","USFS","Ochoco N.F.","Ic 5, Engb(T)","Initial Attack, Line Construction, Hose Lay, Mop Up","4","5 Person Crew, Type 4 Engine, Type 6 Engine (X2)","Training;","Readiness/Preparedness;","Initial Attack;Extended Attack;Transition;","Communications;","","","While engaged in a simulation incident of wildland fire our crew along with adjoining forces experienced communication difficulties while using the Vertex Standard VX-900V radio. The problems we encountered were a result of the scan feature.

Problems:

1. While I was in scan mode, I was trying to communicate on our incident tactical frequency; several times I accidentally transmitted over forest repeaters. I believe this is due to other incident radio traffic in our area combined with our automatic call back scan feature programmed into our radios. The major problem that occurred was that I took my radio out of scan feature because the five second automatic callback after a transmission and therefore the forest dispatch was unable to reach me. This also caused a problem when I was in contact with dispatch and not using the scan function, people on the incident using the tactical frequency were then unable to reach me.

2. Transmitting with other Vertex radios within 20 foot proximity caused all radios to squelch and no transmission sent.","1. Reprogram radios so they do not automatically call back the last scanned frequency picked up. Also, instead of the radio screen displaying SCAN, it should read the channel that it is set to.

2. I do not know why this happens and do not know of any preventative measures.    1. Have a second person in close proximity scanning other channels or carry two radios. I feel that these corrective actions are not practical because carrying multiple radios is cumbersome and tying up an additional person is ineffective.

2. I walked well away from others before transmitting but this is also unpractical due to time issues.","07/07/2005 00:00"
"24682","6EJQ7QSAFE","2","06/01/2005 00:00"," ","SEASON","","OR","USFS","Ochoco N.F.","Engine Foreman","Daily Activities","4","Engine","All Risk;","Line;","Other;","Communications;","","","I am having problems with my Vertex Mobile radio. Every day during some point my radio will start receiving pure static on our tactical channel that we use for local suppression of fires. For about the period of an hour I have to take the channel out of my scan group or I get to hear static that entire time. I have talked with the radio techs and they had me reduce the sensitivity of my squelch setting. Currently my squelch is set as low as it can go (12) and the problem is still happening. Luckily we haven't had to use the mobile in a fire situation when this is happening or our communication part of LCES wouldn't be in place.","The only suggested correction would be to replace the radio with a new radio that works.    To resolve the problem when it happens we take the channel out of scan then we turn on our handhelds to the tactical channel. This is not a very satisfactory fix though as the handhelds don't have near the transmit power that the mobile does so our effective communication is severely limited.","07/22/2005 00:00"
"24624","6CV2LSSAFE","2","05/29/2005 17:09"," ","GOLDFIELD","","AZ","State","Tonto NF","Asst. Forest Dispatcher","Initial Attack","4","Engines, Overhead, Crew, Aircraft","Wildland;","Support;","Initial Attack;","Communications;","","","In process of sending units to Goldfield fire they were calling dispatch on Channel 6 Mt. Ord repeater. Most of the time the received transmissions here in dispatch were very scratchy and unreadable. Did confirm with the aircraft and field units that they were hearing/receiving dispatch the same way, very scratchy. There were some windy conditions up on Mt. Ord that could've contributed to the scratchiness factor and possible bad antennas. Another situation that could have turned into a serious/hazardous situation. If the bad radio communication were to continue resources were going to get pulled from the incident until safer circumstances were evaluated and in place.","Repair/Upgrade of radio systems/antennas.","05/29/2005 00:00"
"24622","6CUNTZSAFE","2","05/29/2005 10:40"," ","NOT ON INCIDENT/ON RADIO","NA","AZ","USFS","ASF","Ia Dispatcher","Attempting To Read The Morning Weather","5","Na","All Risk;","Support;","Non-incident;","Communications;","","","I WAS JUST STARTING TO READ THE MORNING WEATHER OFF SIM SELECT/ GREENS PEAK IN THE DISPATCH OFFICE ON APACHE-SITGREAVES NF, AND COULD HEAR MY VOICE COMING BACK OVER NATIONAL FLIGHT FOLLOWING AS WELL AS ACROSS THE APACHE AND SITGREAVES NETS. I STOPPED AND WAITED A BIT AND TRIED IT AGAIN. THIS TIME WHEN I JUST KEYED THE MIC BUT DID NOT TALK, WE COULD HEAR A MANS VOICE (IDENTIFIED AS AN INDIVIDUAL ON THE TONTO NF BY SOMEONE IN THIS OFFICE) READING THE WEATHER, AND IT WAS COMING ACROSS OUR RADIO ON NATIONAL FLIGHT FOLLOWING. WHEN I TRIED READING THE WEATHER AGAIN SIM SELECT/GREENS PEAK, WE SOUNDED LIKE A WEATHER-READING DUET ON FLIGHT FOLLOWING. I DO NOT KNOW IF ANY AIRCRAFT COULD HEAR US. AS A CHECK, I CALLED LAKESIDE DISTRICT FIRE TRAILER AND THEY SAID THEY COULD NOT UNDERSTAND THE WEATHER ON THEIR BASE STATION (ANOTHER PROBLEM) BUT COULD ON A HANDHELD.","WE CAN AVOID USING SIM SELECT OR WE COULD GET THE RADIOS FIXED IF ITS A RADIO PROBLEM AND NOT SOME BIZARRE ATMOSPHERIC OCCURRENCE ETC.    -WE WILL NOT USE SIM SELECT IF/WHEN THIS CONDITION OCCURS. I TRIED SIM SELECT AGAIN A HOUR LATER AND NOTHING CAME OVER FLIGHT FOLLOWING.

-THE CENTER MANAGER HAS RELAYED THIS OCCURRENCE TO SWCC.","05/29/2005 00:00"
"24623","6CUV55SAFE","2","05/28/2005 18:20"," ","FISH CREEK","AZ-TNF-IA039","AZ","USFS","Tonto NF","Asst Forest Dispatcher","Sending Resources To Incident","4","2 Engines, Law Enforcement, Helicopter","Wildland;","Support;","Initial Attack;","Communications;","","","Fish creek incident was reported by local county sheriff's department. Dispatched a helicopter 323, two Tonto engines and a Law Enforcement Officer.  The helicopter responded to incident and first over scene, they provided size-up and location of incident which was not accessible to aircraft. The LEO was en route and next on scene, while en route and on scene the LEO attempted to call dispatch on the radio using Channel 6 on multiple repeaters (Mt Ord & Bronco Butte) with no success. We here in dispatch were not able to receive any radio transmissions from the LEO but folks in the field were able to hear him loud and clear. People from the Roosevelt Lake area, Mesa Ranger District and residence from Tempe, AZ all heard the LEO loud and clear on their mobile or handheld radios. The Forest Dispatcher called from his residence and held the radio to the phone where I could hear and understand the conversation the LEO was having with the incoming engines. The helicopter stayed as long as they could due to fuel and sunset time to relay between the LEO and dispatch. After the helicopter left there was no communication between dispatch and the fire. As units got closer they relayed for the LEO until we could no longer hear them. There was no communication on and off for a while until the LEO got back out to a location where he could contact us. Fortunately this was a small fire with not much activity, if this had been a fire with activity this would and still was a hazardous situation.","Repair of old radio system and antennas.","05/29/2005 00:00"
"24666","6E8R7RSAFE","2","05/28/2005 10:45"," ","TAYLOR RX","","NM","USFS","Magdalena","Firefighter","Monitor And Rehab","1","Crew Trucks","Prescribed/Fuels Treatment;","Support;","Other;","Equipment;","","","This SAFENET involves a potential problem with a 2002 Ford F-350 six passenger crew truck. The vehicle has a 5 speed manual transmission. The vehicle was parked on a very slight incline of 2% to 4% grade left in reverse gear and the E-brake applied. The vehicle was un-chocked at the time the incident occurred. After being parked for approximately thirty to forty five minutes, the vehicle unexpectedly rolled backwards for about fifty feet and crashed into the other crew truck. Upon inspection of the vehicle immediately following the accident it was confirmed that the truck was in fact in reverse gear and the E-brake applied. The truck gave a repeat performance later during a crew shuttle operation. The truck was being driven by a crew member from another agency who was not aware of this potential problem. He too applied the E-brake and left the rig in first gear. This time the vehicle rolled forward right after the driver got out of the vehicle, and was stopped by a crewmember who was being shuttled. This occurred on a much steeper slope of about 20%. Again it was noted that the truck was in gear and the E-brake applied.","When the accident first happened it was quite a surprise due to how slight the incline was, only about 2%. We did however conduct a safety meeting on chocking vehicles at all times. It is currently being noted that every now and then when we remove the chock block, there are times when the truck has rolled up tight against the block and has to be backed up before the block can be removed. This seems like some sort of problem in the manufacturing of the vehicle. We have not taken it to the dealer yet but are working with the fleet manager.","07/12/2005 00:00"
"24621","6CUMQSSAFE","2","05/27/2005 17:00"," ","VEKOL","","AZ","BLM","","Divs","Structure Protection","2","Type 1 Water Tender, Type 6 Engine","Wildland;","Line;","Extended Attack;","Equipment;","","","During the Vekol fire a Type 1 water tender was in place to provide structure protection and to fill engines. The tender had charged lines in place to protect the structure, and its pump had been running for approximately 3 hours. A Type 6 engine arrived to fill its tank from a separate line the tender had in place. While top filling the Type 6 engine, superheated water from the tenders pump caused scalds/burns to the firefighter holding the hose in the engines tank. The firefighter received injuries to his left hand, left thigh, and abdomen (approximately 12-14 % of his body surface area).

The tender was inspected by a certified mechanic the following day. The inspector did not see any return line to recirculate water to cool the pump.","Assure that pumps have a recirculation line in place to cool the water in the pump.    Tender was taken out of service and inspected by certified mechanic.","05/29/2005 00:00"
