"ID", "SAFENET ID", "Iteration", "Event Start Date", "Event Stop Date", "Incident Name", "Incident Number", "Event State", "Event Jurisdiction", "Event Local Unit", "Event Position Title", "Event Task", "Event Management Level", "Event Resources", "Event Incident Type", "Event Incident Activity", "Event Incident Stage", "Contributing Factors", "Human Factors", "Other Factors", "Narrative", "Immediate Action Taken", "SAFENET Create Date"
"24071","6EUNFPSAFE","2","07/27/2005 05:00"," ","COLOR COUNTRY SUPPORT","UNK.","UT","BLM","Color Country","Crwb(T)","Transport During Demob","3","Crews, Crew Transport Buses","Wildland;","Support;","Demobe;","Communications;Human Factors;","Decision Making;Risk Assessment;Fatigue;Performance;Situational Awareness;","Driving competency","On July 27, 2005 my crew was being transported from Cedar City Utah to Las Vegas Nevada by a Crewzers contract bus. Our bus was part of a convoy with two other buses carrying crews demobing from Cedar City to Las Vegas. Our route was south on I-15. During our drive several startling events occured:

-Bus driver missed off ramp that the lead bus had turned off and proceeded to slow the bus down to 15 MPH and was going to stop. I told the driver that slowing to that speed on an interstate with a posted limit of 70 MPH was not safe and to continue on to the next exit where we could get turned around where we could meet up with the other buses in the convoy. Prior to finding the next available exit, the driver started to attempt to cross the median to back track. I stopped this action and told her to continue until the next exit.

-The bus's CB radios did not work, so crew bosses on the buses used their portable radios to communicate for the convoy, adding to our responsibility.

-Throughout our trip, the driver repeatedly drifted over the fog line into the rumble strip and overcorrecting in a rough fashion to get back into the lane.

-Throughout the trip, the driver would look back at me and the other passengers in the front seats for 10-15 seconds at time, diverting her attention from the road.

-During our travel down the Virgin River Canyon, the driver erratically moved from the slow lane to the fast lane to avoid a broken down truck pulled off on the shoulder, nearly hitting the truck and cutting off traffic in the fast lane.

-Other buses in the convoy had to repeatedly pull over to wait or speed to catch up because the driver's speed was so inconsistent. (I could see her speedometer from where I was sitting.)

-During heavy traffic in Las Vegas, the driver would signal late and cut other traffic off during lane changes and exhibited extreme nervousness and doubt while navigating through that heavy traffic.

The other crew bosses in the convoy buses expressed their concern to me and my supervisor about our bus driver's actions. Numerous crewmembers of mine also expressed concern for their safety and the safety of other drivers on our route.","Have all contract drivers be tested and trained to our agencies' standard of driving and have an agency employee certify that driver's ability and level of competency on a annual basis.    After this experience, I would have the driver find a safe and reasonable place to pull off the freeway and attempt to make arrangements for alternative transportation to our destination.","08/01/2005 00:00"
"24694","6EQNWYSAFE","2","07/26/2005 21:00"," ","NONE","421","OR","BLM","Prineville blm","Engine Captain","Demob","4","Type 4 Engine","Wildland;","Transport to/from;","Demobe;","Human Factors;","Decision Making;Risk Assessment;Situational Awareness;","","A Type 4 engine pulled out on the highway while another fire engine, a Type 6 was already traveling at the posted 55mph speed. The Type 6 engine was forced to pull into the other lane and quickly pass the Type 4 engine. There was no time to hit the brakes, because of the unsafe decision of the operator of the type 4 engine. Poor decision making created this unsafe situation.","Human factors are hard to correct. This was a decision made by one individual which could have tragically affected five others.    I informed his engine captain about the situation, and told him that it was unsafe, unprofessional, and totally inappropriate.","07/28/2005 00:00"
"24727","6FNQPYSAFE","2","07/26/2005 17:00"," ","HOMESTEAD","B13M","ID","Other","Boise City","Engine Captain","Enroute For Ia Fire","3","","Wildland;All Risk;","Transport to/from;","Initial Attack;","Environmental;Human Factors;Other;","Leadership;Risk Assessment;Situational Awareness;","Traffic concerns","Dispatched to a fire in the Boise foothills, on the edge of city in an urban interface area, traffic conditions directly limited a reasonable response time. Due to time of day, traffic flow in the city made traveling 8 miles north very difficult and it was clear most of the general public could see the fire burning up the mountain on the edge of town. Due to these conditions my engine and the engine behind us decided that trying to get to the fire was going to take longer and it was better to not be a part of an accident. We slowed to 25 in 45 mph zone and took appropriate actions driving to arrive at the fire without incident. Once on the fire the public was not a problem.","As traffic conditions in the Boise Urban Area continue to become a problem the need to train Engine Operators in official courses that offer lights and siren training, traffic laws and emergency driving procedures would help. In this situation having our lights and sirens on and driving 25 mph would have allowed for a great level of safety while allowing the resources to arrive at the incident in a timely manner.    Discussing the traffic issues and attempting a take alternate routes to fires that may be long mileage wise but less traffic concerns","08/27/2005 00:00"
"24712","6F4METSFIR","2","07/25/2005 21:00"," ","MM 181 FIRE","","ID","BLM","Twin Falls Tanker Base","Firefighter","","3","Firefighters","Wildland;","Line;","Initial Attack;","Environmental;Human Factors;","Leadership;Risk Assessment;","","At 1900 7/25/05 Helicopter N49MA was dispatched for IA on the MM 181 Fire near Twin Pallid. Additional resources responded to the fire (Helicopter N97? with crew) near Twin Falls, ID. A dip site was selected near the fire and both helicopters began bucket drop operations 30 minutes after dispatch. The fire was fueled by a stack of hay bales. The surrounding area had irrigation canals, irrigated fields, water bodies, and other sources of water in the area. The dip site was jokingly called a sewage lagoon by the crews and worse. During the operation you could have taken you Incident Response Pocket Guide and thrown it out the window. Those responding were clueless about which dip site to select. Radio communications from air to ground was not working because radios were not properly cloned. The manager and crew failed to open the bambi bucket properly with center ring pulled out enough to engage the aluminum spokes. This caused much spillage and slinging sewage sludge everywhere. Preceding the second dip or during filling the N49MA manager and crew had to redeploy a nasty bucket with bio-solids and unknown substances. The weather was hot and sunny. The fire was putting up a vertical column of white smoke that could be easily seen from the Twin Falls Tanker Base. At 2100 IA resources returned to the helibase. I along with other personnel was ordered to clean and disinfect the contaminated buckets and gear. The splash back residue from the buckets left an oily residue on nomex clothing after drying or unknown origin. Crew members complained about eye irritation and the helicopter mechanic complained about possible damage to the bucket and equipment. I was more concerned about personnel involved, exposure to unknown pathogens, lack of proper PPE, not following proper procedures to set up a decontamination station, possible forage & food contamination, and environmental impacts. In addition if hazardous gases such as dioxin that may have been released during the fire, fire fighters should be fully informed, aware of the dangers, chemicals, pathogens and wear approved PPE. I mentioned my safety concerns fellow personnel. The next day, I was asked to leave and received my return tickets to my home base.

Failure to follow Standard Fire Fighter Orders

7. Maintain prompt communications

10. Not providing for safety first

Watch Outs

3. No safety zone for decon station

5. Uninformed on hazards

6. No clear instructions (radio failure)

14. Weather becoming hotter and drier

Note: Triage: If situation appears to be unsafe (floating sewage). It probably is unsafe.

Urban Interface – Hay bale are not defensible structures and someone could have been severely injured trying to save a few hay bales.

Symptoms included: Skin and eye irritation (face, arms, and hands) headache, shortness of breath, general nausea.","Wildland fire fighters need to receive HAZMAT training for urban interface, agricultural chemicals and hazardous waste exposures. Managers need to be more aware of what pathogens they are exposing crews to and how to follow proper paper work procedures in documenting exposures. We can not spread hazardous material all over creation just because there is a fire. Note: It would be a good idea for everyone involved to have the appropriate shots , revisit the helicopter crew member task book, gain more awareness working under the rotors, and learn more about approved PPE requirements. Operations should make sure proper PPE is available to fire fighters on incidents. Managers should have verified the pilot was carded to spread bio-solids and helicopter placarded with bio-hazard symbol. The proper paper work and permits should have been completed by managers. Consider;

¨	Bio-solids Applicators Permit required by EPA

¨	Sample Testing Required by EPA every 4 months

¨	Erosion Control Devices

¨	Specified distance from waters of the US

¨	Part 503 Restriction on harvesting food or crops for 20 months

¨	Restriction for 30 months on below ground crops (potatoes, etc.)

¨	Land owner is required to keep these records

¨	RCRA guide line responsibility and must be followed

¨	State Agricultural regulations for bio-solid application

¨	Check storage of contaminate ash residue requirements

¨	Follow your local Cooperative Weed Management Area guidelines for moving helicopters and fire vehicles from fire. Noxious weeds could have been spread from helibase to incident MM-181 alfalfa field

¨	Provide crews with a map of approved dip sites","08/09/2005 00:00"
"24696","6ERMMKSAFE","2","07/25/2005 18:00"," ","CAMEL","","NE","FWS","","Ict3 / Fmo","","4","Engines & Atv's","Wildland;","Line;","Initial Attack;","Communications;","","","Communication failure of the Racal portable radios. Despite being programmed for local freq.'s incoming (new federal) resources were unable to communicate with other resources on the fire. This seems to be a Racal radio based problem as other P25 radios worked well.

Line of site and repeater both failed.

Land mobile radios worked fine.","Ensure that Racal radio's are properly functioning prior to use on the fire line. It would appear that the new digital systems or Racal may require more repeaters than older systems used.    Efforts were made to swap radios, but there was no improvement. Local Racals didn't work any better than out of area ones. Efforts to keep a truck radio in the area and use voice communications between forces. For some periods of time we had no communications between forces other than visual.","07/29/2005 00:00"
"24728","6FNQZKSAFE","2","07/25/2005 00:00"," ","LOCAL OPERATIONS","","ID","BLM","","Fire Supervisor","Radio Communications","4","","Wildland;","Line;","Other;","Communications;","","","This is a general concern about the EF Johnson handheld and mobile radio used by Idaho BLM. These radios, though easy to function, are not reliable for fire operations where communication is critical. The handheld radios do not easily accept programmable tones, such as tone 1, tone 2 etc... Also they bump from channel to channel and in fire operations this is a hazardous function. The mobile radio volume control and group selector are very sensitive to being bumped. These are also difficult to program multiple needed tone for transmitting.","Not sure, make EF Johnson make a radio more suitable for fire operations    The best thing I have found is to scan no more than 3 channels otherwise the radios cannot handle this function.","08/27/2005 00:00"
"24688","6ELTGKSAFE","2","07/24/2005 14:44"," ","PEACHVILLE","AZ-TNF-143","AZ","USFS","Tonto NF","Adfmo","Mopup, Line Construction","3","Crews","Wildland;","Line;","Mop Up;","Communications;","","","A medical emergency occurred on the Peachville Fire outside Superior, AZ. The units on the fire called Dispatch to inform them of the incident and to request medical assistance. Dispatch answered the calling unit and the unit described the problem and the help that was needed. After the identifying call into Dispatch the dispatcher could not hear the calling unit well enough to understand what they were asking. This happened at least twice more and wasted at lot of time when medical help was needed.

This has been an ongoing problem with this particular repeater (Signal Peak) but the whole radio system has had serious problems, mostly with Dispatch not being able to hear field units and asking them to repeat their message on a consistent basis. The radio system has been a burden for a long time but it seems to be getting worse this year. Field units can't talk to each when they can see each other but they can hear other field units better than the dispatch office can. The Dispatchers should be able to hear better than anyone off of all the repeaters but field units are hearing other field units loud and clear but the dispatchers are asking them to repeat their messages. It is a serious communication/safety issue.","Fix the repeater system on the forest or the dispatch console so messages don't have to be repeated on a consistant basis.    Dispatch has struggled with this all year. They have filed their own safenets about this and talked to the radio technicians, but the problem persists. I have told dispatch about the problem and they have passed it on to the techs so now I am sending this.","07/24/2005 00:00"
"24687","6ELTD5SAFE","2","07/24/2005 14:10"," ","PEACHVILLE","AZ-TNF-143","AZ","USFS","Globe RD","District Fire Management Officer (Neighboring Ranger District)","Not Assigned To Peachville","3","Injured Crewmember (Unknown), Tonto Dispatch, Peachville Helibase","Wildland;","Line;","Mop Up;","Communications;","","","At approximately 1410 hours on July 24th a radio call was placed from Peachville Helibase to Tonto Dispatch (over the Forest repeater channel 6, tone 2)requesting immediate response from an 'air evac' helicopter for a 'serious' injury (chainsaw cut to the thigh)on the Peachville Fire. I was working at my desk at the Roosevelt Ranger Station, monitoring both my handheld and base set radios (both Bendix-Kings). Although the transmission from Peachville Helibase to Phoenix Dispatch was slightly 'scratchy', it was readable and concise. The Helibase requested that Phoenix Dispatch launch a medical helicopter to the fire area, with instructions to contact helicopter '2HL' (a medium helicopter working the fire) on the designated air-air VHF frequency. After the initial call from Peachville Helibase, Tonto Dispatch requested 'clarification', as they were unable to correctly decipher the entire message. Peachville helibase repeated the message (which again was slightly scratchy, but readable on the radios in my office). Again, Tonto Dispatch called back to Peachville helibase indicating that they were unable to copy the entire message (talking with the Dispatcher later, I was informed that they were only hearing 'bits and pieces' of the message). At this point I dialed the phone number for Tonto Dispatch and relayed the information to the dispatchers. As I was dialing the phone, an Engine Captain from the Pleasant Valley Ranger District attempted to contact the dispatch office on Tonto Forest repeater channel 6, tone 3, to relay the same information (evidently he was also hearing the Peachville helibase loud and clear. My concern is that the Forest repeater system is NOT working to acceptable standards, which DID and WILL in the future continue to pose a SERIOUS SAFETY issue for the firefighters and other employees working in the field. The Forest has had an ongoing problem with the radio system, which only seems to have gotten worse with the advent of 'narrow banding'. Even with a new radio console in the Dispatch office, communications throughout the Forest are 'hit and miss' at best. It is my conservative estimate that 75% of all transmissions from field units to the Dispatch office are asked for 'clarification' ('unit calling Phoenix, please repeat, you were unreadable') at least once, and often many times. The Peachville medical incident is a wake-up call that must NOT go unheeded. Viable communication is the cornerstone to fireline safety. The operational viability of the current radio system on the Tonto is in direct conflict with the basic safety philosophies that govern wildland firefighting (LCES, 10 & 18, etc.).","The Forest needs a total overhaul of the current mountain-top repeater system. Funding issues CANNOT be used as an excuse when life safety is involved. The Forest also needs a 'full time' communications shop dedicated to the maintenance and repair of existing infrastructure, mobile radios, hand held radios, telephones, etc.","07/24/2005 00:00"
"24702","6EWLJQSAFE","2","07/24/2005 13:30"," ","KNOX FIRE","B1PM","MT","State","","Firefighter (Engb Trainee)","Line Constuction","3","1Engine, 3 Helitack","Wildland;","Line;","Extended Attack;","Fire Behavior;Communications;Human Factors;","Decision Making;Leadership;Situational Awareness;","","In the afternoon of July 24, my engine crew (2 people) and 3 helitack personnel were asked to form as a squad to head to a spot fire and go direct on it. I was to be in charge. There were 2 Helicopters working the spot and air attack was leading us in along with the local land owner. As we arrived on scene air attack was instructing us on what he thought needed to be done. His plan of attack was for us to get to the black, go down hill and try to fine a safe anchor point, and then construct line back up hill. But when I sized up the situation things were a bit different. This spot fire was burning on a 50-60% slope, we didn't have clean black and there was a good chance of reburn. There was no lookout for us, communication was hit and miss, from what I could see our escape route would have been back up hill and there was no safety zone. But air attack kept laying on the pressure to get in there and get something done, 'you have to do something'. Even though it was a useless mission, and I wasn’t comfortable committing my crew. Air attack was more willing to risk 5 people's lives than to burn up a few more trees.","Don't trust what other people are seeing; make your own judgment with your own eyes. Making firefighter safety your number 1 Priority.    I came up with trigger points and other contingency plans. I was ok being up there directing the helicopters, but once they needed fuel we were out of there. And it was a good thing too cause 10 min after we left the spot fire blow up and took out the area we were in.

10 and 18

LCES

SA

Gut feelings","08/03/2005 00:00"
