"ID", "SAFENET ID", "Iteration", "Event Start Date", "Event Stop Date", "Incident Name", "Incident Number", "Event State", "Event Jurisdiction", "Event Local Unit", "Event Position Title", "Event Task", "Event Management Level", "Event Resources", "Event Incident Type", "Event Incident Activity", "Event Incident Stage", "Contributing Factors", "Human Factors", "Other Factors", "Narrative", "Immediate Action Taken", "SAFENET Create Date"
"24691","6EPPE8SAFE","2","07/19/2005 14:00"," ","JUNETTA FIRE","OR-UPF-0071","OR","USFS","Cottage Grove RD","Ict4 (T)","Locating Fire, Line Construction, Transport To/From Fire","4","Crew, Overhead","Wildland;","Line;Transport to/from;","Initial Attack;","Communications;","","","After initial dispatch to the Junetta fire, there was constant lack of communication between all parties related to the incident. For approximately one hour, the IC, and IC (T) were unable to converse on the mobile radios whatsoever. At several other points during the hike into the incident there was sketchy or no communication via the handheld radios in locations that separated individuals by less than 1/2 mile. Communication with dispatch was usually possible, and there was a 'human repeater' that was sometimes possible. However at some points the Vertex radios could not communicate with the human repeater with unbroken line of sight. The concern is that if a critical situation had arisen at any of the instances communication wasn't possible, we could have a huge safety issue. If there was a serious injury, it may not be possible to get a hold of the appropriate personnel to get evacuation of medical attention to the victim.","To prevent this issue from happening again, we need to scrap the Vertex, or at least boost the power (if possible) to an acceptable level. At this point the old Bendix Kings were 10 times stronger both on transmit and receive, and there were very few communication black out areas on the district. Now those black out areas are larger, and much more numerous. With communications so important in the 10, 18, and LCES, and Safety always being priority number one, it seems silly to be using inferior quality radios when safer, more effective radios exist. If no change in our current radios happens, then nothing will help this issue.    We attempted to use dispatch, and human repeaters, and that was successful maybe 25% of the time.","07/27/2005 00:00"
"24680","6EJP6LSAFE","2","07/18/2005 13:00"," ","ESMERALDA","","NV","BLM","Elko Office","Engine Foreman","Line Construction","2","Crew, Engine, Overhead","Wildland;","Line;","Extended Attack;","Communications;","","","On our last day of availability on the Esmeralda fire a type 2 incident management team took over the fire. Our first issue was that the team was not capable of programming our Vertex radios as they do not have software for radios they had never even heard of. At least once the team arrived they gave each division a national tactical channel which had already been programmed into our mobile Vertex. Since we now believed that we had solid communications using our mobile we were no longer attached to another engine. We were used as a lookout by an IHC crew while they cold trailed a long piece of line that they could not see all of. Communication throughout the day was kind of spotty we thought but at least we were hearing talk on our mobile. At about One o’clock one of the shots walked up to our lookout position and told us that his superintendent was trying to reach us on the divisional tactical channel. I tried to raise him on the channel and after sever try’s had not heard anything back. Just then the crewmembers handheld King came over very clearly and the sup told his crewmember to give us his king so we could discuss the plan for the rest of the day. I was greatly shocked to learn that my mobile radio didn’t have enough power to transmit to the sup but a handheld king radio worked just fine.","Getting everyone digital King radios seems to make sense as they are hand programmable and apparently have more power then a Vertex mobile radio.    We were unable to use either our hand held or mobile Vertex radios to stay in communication so the incident just went ahead and demobed us a couple hours earlier than scheduled to alleviate the huge safety issue not being in communication truly is.","07/22/2005 00:00"
"24730","6FRLXUSAFE","2","07/18/2005 00:00"," ","WHITEWATER","","OK","State","","Crwb","Mop-Up","4","Crews, Equipment, And Overhead","Wildland;Training;","Line;","Initial Attack;Non-incident;","Other;","","Faulty Fireline Pack","I'm concerned about the design of my Fireline Pack. Description: The Eagle Pack (made by Eagle Gear); U.S. Patent: #5,314,973.

On three different occasions, my Fire Shelter fell out of its carrier while I was performing work on the fireline. Luckily, one of my crewmembers noticed it before we traveled too far. The design of the pack, combined with the weight of the New Generation fire shelter, were obviously the contributing factors.

I've also been told that this happened at one of our Training courses in Oklahoma recently. The Faulty pack in that case was the exact same design and brand.

If this were too happen during Initial Attack the consequences could prove fatal.

Please call if you have any questions. (501) 276-5377.","Redesign or discontinue production of this particular pack.","08/30/2005 00:00"
"24679","6EJNDTSAFE","2","07/15/2005 21:00"," ","ESMERALDA","","NV","BLM","Elko Office","Engine Foreman","Line Construction","3","Engines, Equipment, Overhead","Wildland;","Line;","Initial Attack;Extended Attack;","Communications;","","","We arrived on the Esmeralda fire at the request of the initial attack incident commander. When we arrived it made a total of seven resources on the fire that was about one hundred and fifty acres at that point. Since you need a laptop and the software to program a Vertex Mobile we had to use only our handhelds since we can program them by hand. At first communication was fine as the fire was still relatively small. As the fire progressed and increased in size we started losing communication with the other resources on the incident. Our Vertex handhelds just didn’t seem to have enough power to communicate on a simplex channel at any distance. We were then limited to the distance we could be stationed from other resources.","The only fix that I can come up with is to replace the Vertex radios with something that has more power and a mobile that can be programmed in the field without a laptop and the software.    We had to resolve the problem by being constantly attached to another resource on the incident so that they could inform us of what was going on.","07/22/2005 00:00"
"24690","6ENTX6SAFE","2","07/15/2005 00:00"," ","CONTACT","NV-EKD-615","NV","BLM","Elko","Division Supervisor","Mop-Up","3","Equipment - Dozer","Wildland;","Line;","Extended Attack;","Communications;","Situational Awareness;","","Information disclosed is obtained from involved resources 24-48 hours after the 'event' occurred. There was a Type 3 team assigned .  

I arrived on scene during Mop-up as a Div. Supervisor (A) on the opposite side of the fire from where the event occurred. I took note of a pattern of dozer lines on a steep hillside that caused me to question what had occurred in earlier operations.

I had been informed at briefing that unexpected winds (about 25-30 mph) had fanned the N. edge of the fire when they thought they had 'buttoned-it-up'. One IHC Supt. described it as 'chaos' as the fire raced N. down the slope toward the edge of the community of Contact.

On our last day 7/19 I offered up assistance to the 'team' with contract equipment inspections (my trainee needed this experience) and it turned out no pre-inspections had been conducted. It was at this time that I took the opportunity to ask the dozer operator about those steep dead-end dozer lines on the hillside. This was a first-year operator. He told me '...it was really exciting out there but kind of scary cause he couldn't talk to or hear anyone.' He told me that his dozer had stalled on the hillside and the fire was coming at him. He got out and ran to the nearby rock outcrop until the fire passed over his dozer. The fuel-type in this area was grass and sagebrush. After the fire passed he made it back to his dozer and it started up ok.

I then talked to the other seasoned dozer operator. He told me that when they tried to get a radio at BIFC/NIFC; they told him they would get one on the incident & that this was common practice.

I then decided to go to the I.C. I asked him what their policy is w/ regard to dozers and radio communications. He told me that he usually carries extra radios but he didn't have one. He said that they 'mitigate this situation by assigning another tactical resource to the dozer' and in this case it was an engine crew. I offered that in our region a contract dozer cannot go on line with out a dozer boss directly assigned. He said that a dozer boss is ideal but repeated that assigning another tactical resource is mitigating the situation.

At the end of our last day, my assigned trainee called for an after-shift AAR. The I.C. asked for input to 'take forth' and up the line. I gave the last comment. I mentioned that they need to make a change in their policy with regard to use of contract dozers without adequate radio communications or dozer bosses. One of the other remaining resources gave a supporting comment of agreement stating it is a major safety violation'.

(From my interpretation of the situation that occurred)

STANDARD FIREFIGHTING ORDERS COMPROMISED:

2. Know what your fire is doing at all times.

7. Maintain prompt communications with your forces, your supervisor and adjoining forces.

9. Maintain control of your forces at all times.

WATCH OUT SITUATIONS COMPROMISED:

7. No communication link with crew members or supervisor.

8. Constructing line without a safe anchor point.

11. Unburned fuel between you and fire.","Do not deploy contract dozers on the fireline without (at a minimum) a qualified representative that has direct tactical & command communications to relay to the dozer operator. Ideally the operator should have a radio and a dozer representative assigned.","07/26/2005 00:00"
"24732","6FUST2SAFE","2","07/14/2005 00:00"," ","SEVERITY","","AZ","USFS","Globe R.D. Tonto N.F.","Engine Boss","I.A.","3","Engine Crew","All Risk;","Line;Readiness/Preparedness;","Initial Attack;","Communications;Equipment;","","","During the dates 7/14/05 through 7/27/05 my engine crew and I went on a 14 day detail to Globe R.D. on the Tonto N.F. in Arizona. During this time frame we encountered many problems with our current radios. Here in Region 6 we decided to save some money two years ago by buying radios that were cheaper to purchase than King radios. Vertex radios were the radios that were purchased by some forests and these forests are using them exclusively. When we first received our Vertex’s, there had been a lot of problems and grumbling about how bad these radios were. Most problems I heard people talk about were how there were too many features, and it did not work as well as the King radios. Here at our district I know everyone was opposed to them from the start. We in Fire tried very hard not to judge the Vertex before we had a chance to use them, and after getting used to most of the features found that the radio performs ok for our home district users. The problems we had in Arizona are problems that all of us with Vertex radios will have when leaving our home districts. Tone controlled repeaters are used in many parts of the country and the Tonto N.F. is one of those places. We arrived in Globe and our first task had been to figure out communications, we spent many hours programming all of there frequencies in to our radios, we found that we were unable to use our radios with tone controlled repeaters. We attempted to fix this problem during the whole 14 day assignment, but we were rarely ever able to communicate with any one using the Vertex. The Ranger District had one extra King they were able to lend us but this did not fix the problem at all. We responded to three dispatches during this time and most of our communications with the dispatch center had been by cell phone, and the only radio communication had been with the borrowed King. Another concern I have with our current radio situation is the nonprogrammable radios we have in our vehicles. On our home district there are many areas that we can not hit repeaters with our handhelds and the extra power in the vehicle radio is the only way to communicate with others.","The obvious answer to this is for all employees to have King Radios again; I know that this is not impossible, with the dangers all forest workers deal with these days, and the fact that we know how important communications are, we have to buy a radio that will work in all areas. Another possible answer is to have King Radios at each district for those individuals who have to go off forest. Type 1 crews are allowed to purchase and have Kings for their travels during the summer, and this shows that these problems have already been noticed, and it is time for us to realize that not having communications is a very dangerous situation and is one of our 10 Standard Firefighting Orders that we all are responsible for following.    See Above","09/02/2005 00:00"
"24667","6E8RFZSAFE","2","07/12/2005 11:34"," ","RECON OF DISTRICT","","MT","BLM","","Center Manager","","5","","Wildland;","Readiness/Preparedness;","Non-incident;","Communications;","","","We were having trouble with National Flight Following and our Antoine repeater on 7/11/05. We contacted our radio shop and they advised that QWEST Communication would be coming in our direction to find out what the problem was. Today QWEST and the radio technician showed up to fix the problems. The radio technician headed to Antoine Repeater site and QWEST was to head to Judith Mtn. site.

At approximately 1117, our Air Attack aircraft went up for a recon. At 1134 a high pitch tone came across our radio. We tried to contact the Radio Shop to see if they could get a hold of the QWEST tech and have them stop the tone. The QWEST tech was running tests on the circuits here in town and had gotten onto the wrong one causing the piercing tone over the radios. During this time, we were unable to Flight Follow on Lewistown Simplex or any other frequency due to the high pitch tone. Air Attack is returning to airport due to no Flight Following capability.

At approximately 1208, the tone pitch ended.

Air Attack reported that they started to receive the high pitch tone on Air Guard about 5 miles out of Lewistown. This caused them to have to shut their radios down.

Dispatcher kept in constant contact with the radio technician during this whole situation, who in turn was in contact with QWEST technician. This issue is being resolved between QWEST and Radio shop.","Dispatcher kept in constant contact with the radio technician during this whole situation, who in turn was in contact with QWEST technician. This issue is being resolved between QWEST and Radio shop.","07/12/2005 00:00"
"24668","6E8T9NSAFE","2","07/12/2005 00:00"," ","ASNF RADIO PROBLEMS AGAIN","","AZ","USFS","","Firefighter","Etc","3","","All Risk;","Readiness/Preparedness;","Non-incident;","Communications;Equipment;Human Factors;","Decision Making;Leadership;Performance;","Inexperienced and or Short Staffed Comm Techs","There seems to be a chronic problem with radio communications on both the Apache and Sitgreaves side of the forests for months now. Today dispatch has been down off and on due to an unknown problem again. As a person on the ground I or my colleagues do not have any confidence in our communication systems on the A/S NF. Management does not seem to know what the problem is either.","Bring in a professional contractor or agency person from outside of the AS-NF to assess the problem.","07/12/2005 00:00"
"24664","6E8HPNSAFE","2","07/11/2005 17:00"," ","IA","","WY","USFS","Eastern Wyoming","Fire Management Officer","","4","Engine Crews, Helicopters","Wildland;","Support;","Initial Attack;","Communications;","","Factors are inability to fix a radio repeater problem.","The Casper Interagency Dispatch Center is responsible for dispatching to both the Forest Service on the Med-Bow and National Grasslands National Forest as well as the BLM in Eastern Wyoming. The dispatch center normally operates off of a BLM base station, BLM repeaters, and FS repeaters. The main repeater for communications with the Med-Bow Forest is the Laramie Peak Repeater. Several weeks ago the Forest Service had some problems with the Laramie Peak repeater. Subsequently the Casper Interagency Dispatch was only able to communicate with the Forest Service through the BLM repeater. We were told the problem would be fixed as soon as possible. The problem still is not fixed and the center was told yesterday it would be fixed in a couple of weeks. This is what we have been told the previous month as well. There is communication with the Forest Service through the BLM repeater but this communication ties up the BLM base station which is used by resource staff and for initial attack by the BLM. With the increasing chance for multiple fires throughout the Zone, the potential to tie up the BLM frequencies and lose communication with IA forces exists and needs to be corrected immediately. With temperatures near 100, possibilities of thunderstorms, and heavy fuel loadings IA forces and aircraft need to have clear lines of communications with the dispatch center. Knowing what the problem is and saying someone will get to it in the next couple of weeks is unacceptable when the possibility to lose one of our key orders...COMMUNICATION...is a real possibility. Yesterday with five new IA's, a Forest Service Lookout, two helicopters, and multiple IA forces as well as BLM resource staff trying to communicate to the dispatch center, the BLM frequency had multiple users a couple of times trying to get a hold of dispatch and unable to do so.","We are told the way to fix the Forest Service repeater so that folks can communicate to the dispatch center is not a difficult task and can be done in one day. This needs to be done immediately.    This problem has been documented and the State FMO has been working with the FS on getting this problem fixed. The Dispatch Center Manager has been on the phone daily with the Forest Service to get this problem fixed but the response has been slow on an issue I feel is of great importance.","07/12/2005 00:00"
"24671","6EAV8JSAFE","2","07/11/2005 16:30"," ","CHAPMAN FIRE","BS4V","AK","BLM","","Akk Cache Manager","","3","","Wildland;","Support;","Demobe;","Equipment;Human Factors;","Decision Making;","","SAFENET Information:

July 11, 2005

Incident Name and Number: Chapman Fire (BS4V)

Incident Type, Activity and Stage: Wildfire, Support, Demob.

Location: Fort Wainwright, Alaska 1544 Gaffney Rd. AFS Warehouse

Contributing Factors: Human Factors and misuse of equipment.

On Monday, the 11th of July, the AFS warehouse received backhaul from the Chapman Fire. The backhaul included a Fedco (NFES 1149…pump, backpack) that contained approximately 1 gallon of liquid that turned out to be drip torch mix fuel. Fedco’s routinely come with liquid in them and are emptied at the beginning of the refurbishment process. In this case a warehouse employee opened the Fedco to drain and got drip torch fuel on their hands and it also resulted in a small fuel spill.

Issue:

Backpack pumps are for dispensing of water only; this was an inappropriate use of that equipment that could have resulted in injury/exposure to personnel, is a serious violation of transportation of fuel and a possible fire hazard.","We need to continually educate the firefighter/incidents that the shipping and packaging of fuel from the field to the Caches is a serious matter.    Corrective Actions:

1) An inquiry into the source of this misuse of equipment.

2) The filing of this SAFENET.

3) A meeting with fire managers to dispense information to the field personnel throughout Alaska that fuel should never be used in backpack pumps.

4) An e-mail of the above information being disseminated throughout the BLM and State of Alaska Networks.

5) A review of spill response procedures at the AFS warehouse.

Corrective Actions accomplished 7/14","07/14/2005 00:00"
"24662","6E7TVMSAFE","2","07/11/2005 00:00"," ","BAM PREPAREDNESS","","NV","BLM","NV-BMD","Afmo","","3","","Wildland;","Readiness/Preparedness;","Non-incident;","Communications;","Leadership;","","Battle Mountain Field Office is dispatched out of Central Nevada Dispatch Center, located 53 miles away in Winnemucca. The final link in our radio system is a hard-line link from BAM to Winnemucca. Over the 6-plus years that the current dispatch scenario has been in place, this link has failed numerous times, leaving the 11 million acre BMFO without radio coverage for extended periods.

When this has failed in the past, the back-up has been to cut the switch to Winnemucca, and activate the old BAM dispatch.

On 7/10/05, there was a temporary disruption in this land-line connection. However, Nevada Bell believed they had it repaired that evening. On 7/11, the problem re-surfaced, on an intermittent basis. Upon the decision to 'throw the switch' and activate BAM Dispatch, management was informed that BAM dispatch was non-functional. The problem lies in the console not being narrow-banded. The BMFO communications tech informed me that for the last year, the technician from NSO has been unavailable to travel to Battle Mountain to convert the equipment.

As a result, BMFO has no back-up to an unreliable communications system in the middle of fire season.","Provide service to BAM Dispatch to made system narrow-band capable.

In addition, NSO denied our request last fall to purchase several satellite phones to ensure communications in the numerous areas of BMFO with poor radio and cellular coverage.

Allow unit to purchase satellite phones to ensure safety of employees.","07/11/2005 00:00"
"24673","6EDFL2SAFE","2","07/10/2005 06:00"," ","RICCO","","SD","USFS","","Resource Advisor","","1","Individuals","Wildland;","Line;Support;","Extended Attack;","Other;","Decision Making;Leadership;","Abuse of Authority","District personnel were called by the District Ranger, and informed that they were needed to participate as resource advisors on the RICCO fire. One of the district personnel called has turned their red card in, and no longer wants to participate in fire. The District Ranger abused her position by influencing this person to participate, after she was informed by the individual that they had turned in their red card over a year ago, had not participated in annual fire refresher, or the Pack Test. The individual was assigned to the incident for multiple shifts, and had an escort with them.

My understanding of having non red carded personnel on a uncontrolled fire, is okay to have the person visit the line with minimum exposure (i.e. one day sight visit not to exceed a shift or two), with the IC's permission. Personnel that do not wish to take part in fire assigned should not be pressured in the slightest into accepting assignments when there hearts aren't in it.","Review of the Ranger’s training required for agency administrators, and/or line officer. If missing training, must be required to have training completed prior to the next fire season.

Letters of apology to the IC of the Type 1 team, District Fire Management, and to the individual explaining the reasoning of the actions taken, and the corrective actions taken.","07/17/2005 00:00"
"24659","6E62ETSAFE","2","07/09/2005 10:00"," ","STUMP","337","OR","USFS","Ochoco","Ict-4","Communication With Dispatch","5","1 Type 6 Engine","Wildland;","Support;","Initial Attack;","Communications;Equipment;","","","Vertex mobile radio (VX-4000) in fire engine intermittently will display vxSTDcom on the LED screen. This enables the radio from receiving or transmitting until the power button on radio is turned off and then back on. Problems occur when incoming communications are missed during fire operations. This is a safety 'watch out'.","I have placed a ticket with End User Support. Hope to have it corrected soon.    Looking at the screen more often.","07/09/2005 00:00"
"24660","6E63J9SAFE","2","07/08/2005 19:21"," ","MASON","PSF683","CO","USFS","","Ic/Safety Officer","Structure Protection","2","Engine/Crews","Wildland;All Risk;","Line;Readiness/Preparedness;","Initial Attack;Extended Attack;Other;","Equipment;","Decision Making;Leadership;","","Cooperating engine/crews allowed on scene without engine bosses attached to the units. Many of the engines do not have DOT inspections and are not up to NIFC standards for equipment and personnel. The main concern here is the lack of engine bosses for all of the engines that are currently on scene. Also the safety of the crews working along side firefighters that are not properly trained for forest fires.","At check-in, all engines and personnel should be inspected and qualifications checked to ensure proper personnel and equipment is on scene. Cooperators should be held to the same standards as the forest service personnel and equipment. Any engines that do not pass NIFC standards and regulations should be sent home and replaced with engines and personnel that are qualified and meet forest service standards.    Went to the SAFENET system as nobody will listen to me on scene. No changes have been made at this time. Have the engines thoroughly checked before they are allowed to be on the fire line.","07/09/2005 00:00"
