"ID", "SAFENET ID", "Iteration", "Event Start Date", "Event Stop Date", "Incident Name", "Incident Number", "Event State", "Event Jurisdiction", "Event Local Unit", "Event Position Title", "Event Task", "Event Management Level", "Event Resources", "Event Incident Type", "Event Incident Activity", "Event Incident Stage", "Contributing Factors", "Human Factors", "Other Factors", "Narrative", "Immediate Action Taken", "SAFENET Create Date"
"24896","6TEQF4SFIR","2","06/16/2006 16:30"," ","WARM FIRE WFU","","AZ","USFS","North Kaibab NF","Crew Boss","Fuel Reduction - Wildfire Supression","2","Type 2 Handcrew","Wildland Fire Use;","Line;","Extended Attack;","Communications;Equipment;","","","This SAFENET concerns a safety issue, RACAL handheld radios, Model PRC 6894, RACAL 25. These radios lose communications at short range, use an enormous amount of AA batteries. In steep terrain communications are lost between squad bosses and crew bosses. A faller was injured on the fireline, squad boss tried numerous times to contact crew boss to alert helitack of medical emergency. No radio contact was established. Bus driver on scene had to drive bus to crew boss's location. Still crew boss could not get a hold of Division to begin emergency transport. RACAL radios have always posed a problem on the fireline. Elimination of RACAL radios would solve the problem.","The crew boss requested over and over to warehouse personnel for fire crews to be given Bendix King radios. Warehouse personnel refused request. RACALS have been the standard since the 90's. A change of radio equipment from RACAL radios to Bendix King radios would solve a lot of the communication problems within the fire organization on the Navajo Area, BIA, Fire Management.","09/07/2006 00:00"
"24822","6QSP8ZSAFE","2","06/15/2006 00:00"," ","WILD-CAD","2149677","NV","USFS","R4-HTF","Center Manager","I/A Dispatch","3","All","Wildland;","Line;Support;Transport to/from;Readiness/Preparedness;","Initial Attack;","Communications;Equipment;Human Factors;","Performance;","ABILITY TO PERFORM INITIAL ATTACK FUNCTION","On 6/14/06 we broke a fire late in the afternoon and WildCad worked correctly right up to 2000 when we were clear of the incident and then closed up shop. We left WildCad up, as usual, overnight so that it would be immediately available should we have an incident in the evening and require its use. However, when we came in the next morning at 0630, 6/15/06, we discovered that we were unable to run WildCad on any of the computers save one. The one is the main server and all others network with that computer so that all inputs into WildCad are immediately shared between all computers. The ability to have all computers tied together sharing information immediately is a critical function of WildCad, its basic function. This effectively shut down our dispatch capability because it shut down our ability to track our resources, to issue frequencies for command and tactical, to determine closest available resources for fire calls, to determine jurisdictional responsibility, and aviation tracking and frequencies are compromised. We track resources for 3 different agencies covering an area from northwestern Nevada to Las Vegas. Approximately 15 million acres.

We called EUSC (ticket number 2149677) and were informed that they do not support WildCad and would do nothing for us. They stated that the problem was something in our system and we had to fix it. They went so far as to instruct us to investigate our IP config which said our DNS suffix: is Blank. They said that is bad but would not fix it.

However, when we approached them with the problem, EUSC, who are responsible for computer functions, would not support WildCad, (which in not the problem.) We do not understand how they can not be responsible for the whole computer system here when they have the ability, and have exercised this ability, to change our computer functions and affect all parts of our system, including WildCad. Our major concern is that this severely affected the dispatch capability of an interagency dispatch center. Basically removed from us the ability to do our job. The WildCad system is not malfunctioning, the ability to share files has been compromised by EUSC/IT personnel in the interest of security. We are not the only Center experiencing this problem.","EUSC/IT need to realize that CAD systems need to be shared. If they are going to reconfigure anything in an emergency office setting they need to contact us to see if it will impact the ability for us to do our jobs.    Contacted EUSC Forest Ranger, District FMO and Forest Supervisor. Prevention see above statement.","06/15/2006 00:00"
"24821","6QSJNDSAFE","2","06/14/2006 12:00"," ","TRACER","","WY","Other","","Fire Meteorologist","","3","Crew, Overhead","Wildland;","Readiness/Preparedness;","Extended Attack;","Fire Behavior;Communications;Environmental;Human Factors;","Decision Making;Leadership;Risk Assessment;Situational Awareness;","","A missed or delayed red flag warning was documented for portions of southeast Wyoming on Wednesday, June 14, 2006. The missed or delayed red flag warning put firefighter safety at a significant risk during extreme fire weather and fire behavior conditions.

On Tuesday, June 13, 2006, at 0401 hrs, the National Weather Service Office (NWS) in Cheyenne, Wyoming issued a fire weather watch for portions of (not all of) southeast Wyoming for Wednesday, June 14, 2006, based on a forecasted high wind, low humidity, and dry fuel conditions (pre-frontal conditions). The watch for portions of southeast Wyoming was upgraded to a red flag warning on June 13, 2006 at 1209 hrs, and updated again at 0435 hrs on Wednesday, June 14, 2006. At the time of the watch and warning disseminations, zone 290 in southeast Wyoming was excluded.

The exclusion of the zone was based on a report that fuels were not favorable for large fire growth when fire weather red flag thresholds are met (RH less 15% and wind gusts 25 mph or greater) and that 'green' fuel conditions were in place. In the Rocky Mountain Area, this information is relayed by interagency fire management to the NWS using the Rocky Mountain Area Fuels Status web page. This web page provides a 'Yes' or 'No' answer (and remarks) to fuel conditions to the NWS offices in the Rocky Mountain Area, and is outlined in the 2006 Rocky Mountain Area interagency fire weather operating plan as the agreed way we coordinate fuel conditions. The AOP is signed by NWS and Fire Management representatives. FMOs and or Fuel Specialists responsible for relaying the fuels information to the NWS have been briefed and trained by Rocky Mountain Area Predictive Services personnel.

On Wednesday, June 14, 2006, red flag conditions were prevalent across much of Colorado and southern Wyoming. The Cheyenne NWS raised concerns early in the day that fire weather zone 290 was not included in the warning (because of reported fuel conditions), with reports of large fire activity in this zone. Further coordination by the Cheyenne NWS with fire management personnel, NWS concerns of inaccurate fuel information, and NWS concerns of firefighter safety resulted in a red flag warning issued for zone 290 in southeast Wyoming at 1420 hrs, despite the fact that the fuels status indicated that the fuel conditions did not support large fires.

The failure to relay critical fuel conditions to the NWS resulted in a significant delay to issue fire weather watches and red flag warnings for zone 290 to heighten awareness of a significant fire weather event. The Tracer Incident was reported at 1600 acres in zone 290 at 1800 hrs on June 14, 2006. The incident IC stated that the major problems were gusty winds, low humidity and resource shortages.

These types of events and communication break downs in the past have resulted in firefighter fatalities.","All fire management agencies responsible for relaying fuel information in the Rocky Mountain Area to the NWS in support of the red flag program should be reminded by their direct supervisor that these duties will be performed at least once per week and as fuel conditions change.    I change the fuel status web page for zone 290 to reflect actual conditions. I promptly relayed this information to the NWS. However, this is a short-term fix. Refer to suggested action above.","06/15/2006 00:00"
"24824","6QTNXDSAFE","2","06/14/2006 11:00"," ","THOMAS","224","CO","BLM","CRD","Engine Module Leader","Line Construction","3","Type 4 Engine","Wildland;","Line;","Initial Attack;","Communications;","Situational Awareness;","","The E.F. Johnson mobile in Engine 419. 419 was supporting a burnout operation when the E.F Johnson turned to group 95 channel 15 and gave us squelch nose until we hit the push to talk button then it would be fine until dispatch or anybody else would talk on a repeater.","E.F. Johnson needs to understand the problem and find a solution, or just replace the E.F Johnsons with a different mobile radio that works.    Had the radio techs go back into the program of the mobile radio and have it fixed as of right now. While we were on the Thomas fire we just used our Bendix King hand held radios.","06/16/2006 00:00"
"24832","6R2TTCSAFE","2","06/11/2006 13:00"," ","M31 FIRE","CW22","UT","Other","Utah Cnty Fire","Ic Type Iv","Supression","4","Dozers,Engines,Heavy Air Tankers,Lead Plane, Type I Helicopter.","Wildland;","Line;","Initial Attack;","Communications;Environmental;Other;","","Unexploded ordinance = UXO's","A fire was reported on the Army reservation known as Camp Williams. Military security escorted civilian firemen to a no impact zone according to map. However, armed unexploded ordinance with a kill zone of 100 hundred meters was discovered, AS a seasoned airborne ranger once said, 'Remember when the pin is pulled, Mr. Grenade is not your friend'!","If the owning agency is determined then fiscal responsibility, liability, i.e. specially trained personnel can be hired , retained, and deployed for fire suppression, using outside agencies when the protection boundary established is threatened by mutually agreed protocol, suppression can be unified safely. Utilize map of impact or UXO areas. Have UXO techs to survey and remove ordinance.    AAR, contact with other agencies regarding communication interoperability, remove UXO's, Attorney General's office notified of questionable responsibility. Establish SOP'S, Military security to escort outside civilian agencies, however, this is a military base not governed by the same laws concerning explosives, civilians, being a U.S. Army military reservation. Perform fire simulated exercises with the military personnel to correct the inconsistencies; FFSL has tried to mitigate problems since the 1980's.","06/23/2006 00:00"
"24819","6QL896SAFE","2","06/08/2006 00:00"," ","HACKBERRY","NV-LYX-981","NV","Other","","Assistant Center Manager","Dispatch Resources, Communicate W/Field Personnel","4","All","Wildland;","Support;","Mop Up;","Communications;Equipment;","","on going telephone failure","6/8/2006 2200hrs

All telephone lines including emergency lines failed.100 acre Fire was in mop up stage, NDF inmate crews without custody officers were en route back to camp. Crew Supervisors were unable to radio in their departure and time of arrival to camp due to location. Crew supervisors called in on their phones, and were unable to reach dispatch. They called the Assistant Center Manager at her residence to let someone know where they were. She radioed information into dispatch via handheld. She was advised that the phones were down again.

Logistics section of SFIDC was in the process of mobing 'immediate need' resources to 3 large fires in the Las Vegas Area. The Southern Area Duty Officer for the Nevada Division of Forestry was unable to reach logistics; he had pertinent information to aid in the timely dispatch of personnel.

The ongoing failure is a threat life and property. The phone outages have not only affected SFIDC's area of influence, but also the Las Vegas area.","FIX THE PHONE SYSTEM AND PROVIDE FOR A BACKUP SYSTEM SINCE THE CURRENT SYSTEM IS UNRELIABLE.    CONTACTED EUSC MULTIPLE TIMES","06/08/2006 00:00"
"24818","6QHQ5XSAFE","2","06/05/2006 20:15"," ","SHEEP","CO-HEX-027","CO","State","Huerfano County","Lead Ia Dispatcher","Mobilizing Type 1 Crew","3","Crew, Gacc, Local Dispatch","Wildland;","Support;","Extended Attack;","Communications;Equipment;","","","Received late evening order for going fire (for two Type I crews). While attempting to work the order from home via laptop and VPN, I encountered significant problems accessing various necessary 'remote' programs.

After calling help desks and status lines (and trying a number of work arounds) I determined that the FS VPN functionality was down... and 'there is no timeline on when a fix may be available.'

Our local dispatch center's emergency fallback plan if we lose net and server access (we have no alternative internet access) is to find a place with internet access and set up shop with laptops. To discover that the corporate VPN is not reliable means that access to chunks of our data won't be available when we really need it.

Despite repeated pleas to the Agencies to provide redundant network and inter/intranet access for emergency centers, there has been no discernable movement toward providing consistent and reliable support. After hours and weekend access is particularly weak as the agency IT administrators seem to assume that the whole work force is absent outside m-f 9-5.

After action reviews consistently point to dispatch support as critical to safe and effective incident management. I wonder how many hugely expensive fatality accidents have to occur before the 'system' starts to spend adequate monies to ensure 24 x 7 support to the dispatch community.","Redundant access to internet/intranet/server resources at the dispatch center. Solid and dependable off site VPN access to the same resources when power loss outlasts UPS capabilities or when immediate action mitigates against off hour trips back to the dispatch office    I've mentioned these vulnerabilities in various forums over the years.

This particular problem was unresolvable due to the indeterminate response of the FS IT shop, i.e. the 'no idea when the problem will be fixed' response posted on the End User Support Center server status line.

The workaround turned out to be alternately joining and leaving the VPN to access server data OR the internet (and associated web based programs). The FS intranet was never available.

The most immediate 'fix' would be to get the corporate VPN back up and running. Next would be to provide an alternative VPN usable when the main program crashes as it inevitably will.","06/06/2006 00:00"
"24820","6QNM8YSAFE","2","06/05/2006 19:55"," ","JENNY GULCH FIRE","","CO","USFS","South Platte Dist.","Fire Fighter","Saw Work","5","","Wildland;","Line;","Initial Attack;","Human Factors;","Risk Assessment;Situational Awareness;","","While conducting saw work on an I/A fire the sawyer opened the gas cap of the saw approximately 1-2 feet from open flame. Causing second degree burns to the right forearm.

During operations the saw was ran for approximately 20 min. before the incident occurred, the operator stated that he had to restart the saw a number of times and the saw would run for a couple of minutes before dying out again. Thinking the saw was out of gas, he went to open the gas cap and in doing so, vapors that had built up in the tank escaped and ignited inside of his right sleeve.

The individual knew as he was opening the gas cap something bad was about to occur.

Proper PPE was available and worn correctly.

The probable cause of this incident was.

A. Being to close to the fire and not following proper procedures.

B. Winter Blend Fuel, found along the Front Range of Colorado from Oct 1 to around May 1. This fuel has chemicals added to increase the volatility of the gasoline for cold starts and for pollution control.

The saw was not out of gas but it was most likely vapor locking making the saw seem as if it was out of gas. We had purchased this blend of fuel prior to May 1st, not knowing the effects of this fuel blend, was as the air temperature rises the fuel has a lower boiling point compared to the Summer blend fuels causing a higher volatility.","Follow all Safety Practices and Procedures, per the S212 class, the Health, Safety Code Handbook and the Manufacture's Manual.    As the information was discovered, it was shared with the crew.

And all fuel mix was replaced with the summer blend.

A more detailed follow up report will be submitted at a later date","06/11/2006 00:00"
"24817","6QH4KWSAFE","2","06/05/2006 15:15"," ","PAGNI","960","NV","State","","Dispatcher","Initial Attack / Aircraft","3","All","Wildland;","Line;Support;","Initial Attack;","Other;","","ON GOING TELEPHONE FAILURES","During the dispatch of a fire incident, where structures were threatened, the telephone system which includes all incoming Emergency lines and all outgoing calls at the Sierra Front Interagency Dispatch Center failed. The failure resulted in a delayed response of the aircraft to this incident. As the failure is a hardware problem at the Humboldt-Toiyabe National Forest Supervisors Office, it also brought down the Forest Service radio system forest wide.

This is a liability issue for the USFS, BLM, the Nevada Division of Forestry and all cooperators along the Sierra Front. The ongoing failures of this phone system are a threat to life and property as both the incoming and outgoing calls are affected.

This has been an ongoing problem since January 2006, End User Support and the Forest have been aware of the problem as several tickets have been opened.","Purchase the needed equipment, have it installed ASAP","06/05/2006 00:00"
"24836","6R8LMLSAFE","2","06/04/2006 00:00"," ","ANCHORITE","HTF-2006-1158","NV","USFS","","Center Manager","Dispatch/ Logistics Support","1","Multiple","Wildland;","Support;","Initial Attack;Extended Attack;","Communications;","Performance;","","Radio repeater system in the Bridgeport district failed, once again, just as the area was hit by a large amount of dry lightening which sparked 28 new fires in the dispatch area. Without radios Dispatch had no ability to contact the fire personnel in Bridgeport. Cell phone is not an option as cell service in the area is very poor. The concerns with this are obvious; firefighter safety due to no contact with information or backup, potential for small starts to get out of control due to delayed or no dispatch of fire personnel to incidents, possible loss of homes and property from unstaffed fires. The response from the radio technicians was that the breakers cannot take the power load and will continue to trip. They advised us to go up to the repeater and flip the breaker each time the radios went down. Just before the lightening bust were told they would get to the problem on the following Monday. They told us this on a Tuesday. Our concern is with the apparent lack of understanding of the extreme importance of that radio system, not just as a tool to track field personnel, but as a vital link to responding quickly to emerging incidents and thereby safeguarding life and property of the citizens of the District, and of the national forest","Called techs for support. Submitted SAFENET. Worked with the Bridgeport crew to get them any support we could. Better power system to the repeaters with breakers that can handle the power load.","06/29/2006 00:00"
"24815","6QDMBCSAFE","2","06/02/2006 10:30"," ","ON GOING ISSUE","","CO","USFS","Rio Grande N.F.","Engine Foreman","All Duties","1","All Fs/Blm Employees","Prescribed/Fuels Treatment;Training;Fuel Treatment;Work Capacity Test;All Risk;Wildland Fire Use;","Line;Support;Transport to/from;Readiness/Preparedness;","Initial Attack;Extended Attack;Mop Up;Demobe;Non-incident;Other;Transition;","Communications;","","","Issue -

Poor radio communications on the Rio Grande N.F.

Problems -

Since the RGNF started using Pueblo Dispatch, approx. a year and a half ago, radio commo has been sketchy at best. Currently, the Saguache R.D. cannot communicate with Dispatch on the Direct Frequency, and has to use repeaters that have been unreliable. On several occasions in the past three months, local dispatch has been established, to mitigate poor commo with Pueblo, during wildland and prescribed fires. Overall radio commo with Pueblo is poor.

Inter-forest radio commo has also deteriorated recently. The Saguache R.D. base station can transmit to resources in the forest, via Direct, but is unable to receive on Direct, thus having to use repeaters.

Safety Issues -

As previously stated, local dispatch has been established during wildland and prescribed fires recently, due to poor commo with Pueblo. The RGNF has just established fire restrictions and is expecting severity resources this weekend. High fire danger, resources unfamiliar with the area, and poor commo with dispatch is certainly a red flag in the event of a wildland incident. Under these circumstances, the time needed to establish a local dispatch, would delay any engagement of a wildland fire, putting both the public and fire fighters at a greater risk.

These issues aren't confined to fire operations. On 05/31/2006 Saguache District employees were working on the southern end of the district, in an area that should have no radio issues. One of the employees had become seriously dehydrated and was suffering from heat exhaustion. She became dizzy, was extremely pale, and passed out. Fortunately, her co-workers recognized her symptoms and treated her properly, but they were unable to establish radio contact with Saguache. They eventually got in contact with the Divide District, who provided a telephone relay to their supervisor. Luckily this incident ended well, and the employee recovered quickly, but it does demonstrate the fact that the RGNF radio communication is not adequate.

Many EUSC Tickets have been initiated and closed, and we certainly appreciate the support and efforts from our radio techs (they worked on the Saguache radios earlier this week), however these problems still persist.","From what I've gathered, talking to the radio techs, dispatch personnel, and FS personnel, the RGNF radio system is trying to be patched together. Older systems are trying to be couple with modern systems, and integration is not working. I think the entire network and link to Pueblo needs to be assessed and probably needs to be reworked.

The other option would be to establish a permanent (at least during fire/field season) Forest Dispatch, and invest in making the inter-forest network work properly.","06/02/2006 00:00"
