"ID", "SAFENET ID", "Iteration", "Event Start Date", "Event Stop Date", "Incident Name", "Incident Number", "Event State", "Event Jurisdiction", "Event Local Unit", "Event Position Title", "Event Task", "Event Management Level", "Event Resources", "Event Incident Type", "Event Incident Activity", "Event Incident Stage", "Contributing Factors", "Human Factors", "Other Factors", "Narrative", "Immediate Action Taken", "SAFENET Create Date"
"24062","5QX4Q5SAFE","2","08/30/2003 14:25"," ","MINERAL-PRIMM COMPLEX","MT-LNF-000332","MT","USFS","Lolo NF","Safety Officer Type 1","","1","Overhead","Wildland;","Readiness/Preparedness;","Other;","Human Factors;","Decision Making;Leadership;Performance;","","At 1425 hour on 08/30/2003 (Gentleman x) from the Klamath NF arrived at the Mineral-Primm Complex ICP near Potomac, MT to check-in to the incident as a SEC2. During his check-in interview, the Status/Check-In Recorders requested to see his current Incident Qualifications Card. (Gentleman x) said that he did not have it with him and it was on his desk at his home unit. They then asked if he had completed the Standards For Survival annual training this year. He replied that he understood that the SEC2 position did not require having Standards For Survival.

Resource Unit Leader trainee (RUL trainee), with the Bennett Type 1 IMT asked (Gentleman x) for his home dispatch center's telephone number so his qualifications could be checked and faxed to the incident. (Gentleman x) verified that he had not had the annual refresher training, but was a fully qualified SEC2 as shown on a 2002 Incident Qualifications Card. (Gentleman x) said he had not been issued an Incident Qualifications Card for 2003.

(Gentleman x)  also told RUL trainee and the Time Unit Leader that he had been dispatched twice before this season, but those dispatches had been cancelled by the incidents before he left his home unit. On this third dispatch, he actually left the home unit and made it to the Mineral-Primm ICP.

RUL trainee called the Klamath Dispatch Center at 530/841-4600 and talked with the dispatch supervisor. The Center verified that (Gentleman x) was qualified as a SEC2, but had not been issued an Incident Qualifications Card because their records showed that he had not taken Standards For Survival this year. They requested that we send (Gentleman x) back to California.  (Gentleman x) had spent two (2) days in travel status driving from Fort Jones, CA to Potomac, MT and will need to spend another two (2) days in return travel, including time over a federal holiday.

Due to this occurring during a transfer of command period, RUL trainee consulted Demob Unit Leader, from the  Type 2 IMT. Both team Plans Section Chiefs concurred that (Gentleman x) would be declined from the incident and returned to his home unit.","Home units need to verify that all resources listed as available to dispatch have current agency required training and qualifications and are able to accept the assignment.    Home agencies filling resource orders with unqualified personnel should be held accountable and the costs related to those dispatches should not be charged to those incidents.

Training Officers must make all personnel aware of basic training requirements like annual Standards For Survival training. The Klamath NF obviously understood that an Incident Qualifications Card could not be issued without (Gentleman x) completing this training, but they showed him as available in ROSS anyway.","08/30/2003 00:00"
"24405","5R9MPFSAFE","2","08/29/2003 07:00"," ","BLACKFOOT LAKE COMPLEX","MT-FRF-121","MT","USFS","","Hand Crew (Firefighter)","Line Construction, Mop Up","1","Multiple Hand Crews","Wildland;","Line;","Extended Attack;Mop Up;","Fire Behavior;Environmental;","Decision Making;Leadership;Risk Assessment;Situational Awareness;","","On 08-29-03 on the Black Foot Lake Complex, Branch 2,  Division P under the Type 1 Team, at our crew briefing held by Crew Boss and Crew Boss Trainee, our crew was told the we would be cleaning out some brush along a dozer line to help improve passage of vehicles, and that our crew would be working this line all the way to the fire perimeter. At that time, our crew was informed that there would be no safety zones or escape routes. In the event that we had to bug out, we would have to hike down a one half mile of uneven, rocky dozer line to our buggies. Once we reached our buggies there was a two to three mile drive to an open gravel road. At no time was there a safe place to be in the event of a blow up. This continued for several days. The fire behavior in this area was erratic and extreme, with torching and spotting. Once we reached the fire perimeter we then started direct line. At that time, fire was above and below us with multiple spot fires. Once again there were no safety zones or escape routes established or identified. Our Crew Boss left his trainee with us most of the time. The Crew Boss made little effort in joining us in operations. Several times the Crew Boss Trainee had questions and would have to call the Crew Boss on the radio. I felt unsure about this and was concerned about the safety of our crew as well as myself.","I believe that a trainee should be supported by his instructor at all times. I think that all the poor decision-making, and the apparent lack of fire knowledge could have been prevented had the instructor (Crew Boss) been present. I also believe that when a person has too much on their plate he or she should scrape some off.  The Crew Boss Trainee should have asked the Crew Boss to assist him personally instead of trying to take this all on himself. I firmly stand behind the fact that fire knowledge is learned in the field not the classroom. A red card with a Qual earned is better than one just given for the sake of all who trust our Engine Boss's or Crew Boss's. People's lives are at stake every time we go to work. The Ten Standard Fire Orders and the 18 Watch Outs are there for a reason and should be adhered to at all times and never broken.    After the crew returned home, I briefed my supervisor and he supported my decision to submit a Safenet. He also advised me on how to better handle this kind of thing in the future.","09/10/2003 00:00"
"24402","5R2SDBTDEY","2","08/27/2003 00:00"," ","THOMPSON CREEK FIRE (FISH CREEK COMPLEX)","","MT","USFS","Lolo","","Divgs, Safety, Opsc","2","All Personnel On The Line","Wildland;","Line;","Extended Attack;Demobe;Transition;","Communications;Human Factors;Other;","","Poor decisions, unbecoming professional conduct, safety","Three issues: 

1- Transition attempt before incoming DIVGS was comfortable

2 - Transition attempt during disengagement

3 - Leaving Fire and ICP before resources were off line.

On 8/26/03 during the first full briefing of our team the IC said, 'This is the longest transition in history - 3-5 days.'  Although the operational line personnel had only been in camp 12 hours.  This set the precedence for the events of the day.  During the morning briefing personnel were told that the transition was to take place at the end of the operational period.  At 1500 the out going DIVS told the incoming DIVS that he was leaving the fire because he had 4 hours of travel to do.  The incoming DIVS told me this and said he was not comfortable with the division yet and be able to transfer command. I said okay, tell the outgoing DIVS to stay until the end of the shift.

At 1700 another attempt was made to force a transfer of command, our answer was still no.  At approximately, 1710 disengagement was started by the outgoing DIVS. Air attack was brought over and said there was nothing to start a total disengagement from and the crews had solid black on both sides of them.  The outgoing DIVS told air attack he was disengaging so he could get crews to the bottom.  At this time I was up at the top of the division driving the line and found no reason to disengage.  Air attack stated that there were little smokes in the division and adjoining divisions, but nothing to disengage from.  The outgoing DIVS told air attack that he was disengaging because it took the buses too long to get to the bottom so he wanted to start them now.

At 1745, during the disengagement, the outgoing DIVS called the incoming DIVS and wanted to transfer command because the resources were at the bottom of the hill. He was told that a transfer of command would not take place while disengagement was going on.

At 1900 the outgoing DIVS told the incoming DIVS that he was holding a debriefing at DP150 for all his personnel.  The incoming DIVS was present.  Not all personnel from the division were off the line.  The incoming DIVS asked the outgoing DIVS if he was going to debrief those personnel.  He said they can call him when they get to camp.  At 1920 the outgoing DIVS left the fire line and DP150 for ICP.

At 2030, several of the personnel that were left on the line in this division were attempting to contact the outgoing DIVS.  At 2035, the incoming DIVS contacted me about this situation, I told him to round up the IHC and 2 doz operators and 1 DOZB and head them into camp.  At 2045 I arrived in ICP to track down the outgoing DIVS, but was told he already left camp.

My personal ethics prohibit any of the aforementioned transgressions to take place on my branch or fire. I feel that the early attempt to transfer command was to quicken these individuals demob.  I feel the disengagement was an act also to quicken this demob.  But the worst thing for line overhead to do is leave personnel on the line and then leave camp for his personal benefit.  You never ever leave firefighters out on the line, unless it is a planned event.  I also know that this individual could not have done this without the help of his overhead staff.","","08/27/2003 00:00"
"24061","5QTKS3SAFE","2","08/26/2003 14:00"," ","MINERAL-PRIMM","MT-LNF-000332","MT","USFS","Lolo NF","Air Support Group Supervisor","Helibase Crash-Rescue","1","Crash-Rescue Engine, E-324","Wildland;","Transport to/from;","Other;","Human Factors;","Decision Making;Risk Assessment;Fatigue;","","Contractor Resource Mobilization - Violation of DOT, Agency, and Contract Agreement Driving Regulations, 21.0 hours driving to incident.

On 8/25/03, a helicopter support contractor filled an order under agreement for a crash-rescue engine for the Mineral-Primm incident through the Willamette NF.  Upon arrival at the incident, check-in recorded a Type 3, 1979 Ford Rescue Engine with two operators at 1435 hours on 8/26/03.  The departure time from Albany, OR was 1730 on 8/25/03. Travel time en route to the incident was 21.0 hours without a break.

Concern/Issue: Violation of work/rest policy. Violation of DOT, Agency, Contract Agreement driving regulations.","Establish a national mobilization policy for contracted resources to provide a travel plan before mob/demob to the sending dispatch center for approval and documentation. This would ensure driving policy and fatigue management issues are addressed.    Upon discovery of the work/rest and driving policy violation, the resource was ordered off duty and the operators were instructed to rest and report to work at the helibase the following day at 0800.

I asked one the operators if he possessed an inter-state CDL and he said no because the vehicle weight did not require a CDL driver.  The CDL licensing process educates the driver of DOT regulations (10 hr driving within a 15 hour duty day), which is also agency policy.

I provided direction to the operator on the DOT/Agency policy, and also had a discussion of recent fatal vehicle accidents that involved contract fire resources traveling to and from an incident.  I asked him not to feel pressure from the incident, sending unit, or his boss to violate driving policy and consider his safety and the safety of his crew when operating his engine.","08/27/2003 00:00"
"24059","5QSN7DSAFE","2","08/25/2003 20:00"," ","MISSOULA AMORY","","MT","USFS","","Overhead","Overhead","2","Overhead","Wildland;","Support;Transport to/from;","Transition;","Human Factors;","Fatigue;","","Incoming and outgoing overhead stay in the armory overnight.  The sleeping area has no quite hours and the lights are not turned off all night.  Sleeping is very hard because of the noise, lights and heat.  Overhead coming to a fire don't get the needed rest because of the poor sleeping conditions.  The only people subject to this sleeping room are overhead coming and going to a fire assignment.  The overhead that stay in Missoula on assignment get hotel rooms and are able to get the required sleep.  People that have been sleeping on the ground or are about to spend 14 days on the ground are subject to sleeping in the armory sleeping area.  If overhead personnel are being placed here to save money then all the overhead should be sleeping there, including the buying teams, dispatch, and others supporting the Missoula fire effort.

Many of the outgoing overhead will fly all day only to drive home from their jetport.  If they did not receive the necessary sleep because of the poor conditions in the armory then an accident is waiting to happen.  The people at the armory don't care about the work rest ratio or there would be better sleeping conditions.","Place incoming and outgoing overhead in hotel rooms where they can get the rest they need.","08/26/2003 00:00"
"24401","5QNV6GSAFE","2","08/22/2003 13:56"," ","MINERAL-PRIMM COMPLEX","MT-LNF 00332","MT","USFS","Lolo National Forest","Safety Officer T1","","1","Contract Buses","Wildland;","Transport to/from;","Other;","Human Factors;","Decision Making;Leadership;Performance;","","Two Expeditor bus drivers transporting crews from Missoula, MT National Guard Armory (staging) to the Mineral-Primm ICP were found lacking current Standards for Survival training upon check-in.  Further driver interviews revealed that the driver of E-296 (Expeditor Bus #117) had previously attended video safety training at Tiller Complex in 2002 after the assigned team discovered he lacked this training.  An interview with the driver of E-297 (Expeditor Bus #155) revealed the vehicle operator had previously had 'Standards' while on an engine crew in 2002, but had not received the training for this season.

Operations and Safety were contacted by the RESL (T) to advise of this situation.  Operations and Safety advised to reject using the buses and drivers on this incident since they would be transporting crews to the line.  Expeditors did not verify that either driver had received refresher training for Standards for Survival this year prior to hiring them and sending them on assignment.  Both drivers stated to the RESL (T) that they were aware of other Expeditor bus drivers assigned to current incidents without completing a Standards for Survival course this year.  The drivers' time was closed out and they were released to the Missoula Armory for RON due to driving time restrictions.  The Bus Manager at the Missoula Armory was notified that the buses would be returning to him and that the IMT strongly suggests that the drivers not be used for non-line/non-camp duties to send a safety message to the bus company.  The crew desk at Missoula Expanded Dispatch was notified of the buses release and the need to order two more buses with qualified drivers so operational needs could be met on this incident.  Bus driver of E-297 will need to travel home to San Carlos, AZ (3+ days drive). Bus driver of E-296 will need to travel home to Lake Isabella, CA (2+ days drive).","Contract bus company representatives must be contacted and advised of fire safety training requirements for personnel assigned to camp and line support activities. This information must also be conveyed to other incidents, Area Command, and contracting officers who enforce these contracts.

It must be understood by contractors, host agencies, and Area Command (if in place) that incident management teams do not have the resources or the responsibility to provide this training. It is expected that those arriving at an incident will be trained and qualified prior to receiving an assignment.    It must be understood by contractors, host agencies, and Area Command (if in place) that incident management teams do not have the resources or the responsibility to provide this training. It is expected that those arriving at an incident will be trained and qualified prior to receiving an assignment.","08/22/2003 00:00"
"24430","5ZEL7SSAFE","2","08/20/2003 08:00"," ","SOUTH FORK","2013","MT","USFS","MT-BRF","Firefighter","Mop-Up","3","Ic5 And Fftr","Wildland;","Line;","Mop Up;","Environmental;","Decision Making;","Pressure felt by the AFMO to confine fire","The fire was initially flown by the District FMO/Duty Officer and AFMO.  The area was extremely rocky (large granite glacial breakup) and the fire was near the ridge top.  Snags were in the fire area.  Down canyon 6miles was urban interface.  The decision was made to staff the fire with an ICT3 + 15, as it appeared to be okay from the air and water for small pumps on sight.

The personnel were helicoptered in while fire behavior was moderate.

Personnel included another ICT3 and ICT4 in addition to IC. Once on site, the three IC qualified personnel did a risk analysis.  The decision was made at that time to turn down the assignment and disengage, reason being that the area was boulder rubble with flat rocks that could slide and snags were abundant.  Potential for fire to escape the canyon was minimal short of a major wind event.  The water that appeared to be available, viewed from the air, was a trickle.

Communications up to that point were on forest net.  When the turndown was announced, the DO and AFMO asked the IC to switch to TAC2.  On TAC2 the DO and AFMO tried to convince the IC to remain on the incident.  To his credit the IC refused and they were extracted by helo.

A decision was then made by the AFMO to staff the fire with 2 people to 'monitor' the fire and would rotate people in every two days.  Eventually an ICT5 and a FFT2 were selected.  Initial instructions were to stay out of fire area and call for bucket work as needed.  However, the day prior to the accident they were asked to scout the down canyon perimeter for potential retardant line and mop-up.  The following day 8/20, the FFT2 headed back down to check fire.  The events that followed are unclear to him, but he sustained a serious injury to his vertebrae and needed to be life-flighted out.

There is no record of a complexity analysis or risk analysis being done after transitions.

From 8/12/2003 until 9/01/2003 this fire burned 40acres of rock, duff and sub-alpine fir.","A)  Listen to and validate the decisions being made by the people on the ground.

B)  Give clear instructions and make sure they are understood.

C)  Develop a plan of action.

D)  Tactics that fit the situation. (unsafe workplace)

E)  Put FFTR safety first.    Several people have tried to obtain copy of the accident investigation, including the initial IC, that was done by a 'contract' investigator.  The investigation has not made it down to the fire organization yet, 5/28/2004. The word is it is still being reviewed by the line officers.  It was later stated that it was 'unrelated to the injury.'  Things will only change after full disclosure and holding people accountable for their decisions.  With full disclosure and a review, the actual causal factors can be identified and utilized in future decision making.","05/28/2004 00:00"
"24398","5QLTDUSAFE","2","08/18/2003 11:45"," ","PINTO SPRINGS","","UT","State","SWA","Fmo","","5","Fd Engine","Wildland;","Transport to/from;","Initial Attack;","Equipment;Human Factors;","Decision Making;","","On August 18, at or about 1145 hrs, a Type 5 engine, owned and operated by the Newcastle Volunteer Fire Department, rolled over while responding to the Pinto Springs fire.  The operator suffered minor injuries, was treated, and release at the scene.  The Iron County Sheriffs Office, and the Utah Division of Forestry, Fire and State Lands investigated the incident.

At approximately 1100 hours on Monday, August 18, the Southwest Area Office, Utah Division of Forestry, Fire, and State Lands was notified of a smoke report in the Pinto Springs area.  The Iron County Fire Warden responded to the incident, and requested the Newcastle Fire Department also respond.

Newcastle Fire Department responded with a Type 6-engine, a support trailer, and the Type 5-engine.  The Type 6 engine and trailer responded first, and the Type 5 approximately 20 minutes later.  The driver left the station and was traveling south on Main Street.  As he approached the intersection of Center and 200 south (West Pinto Rd.) he began to downshift the vehicle in order to make a 90 degree corner to the east.  During the attempt to downshift the driver lost control of the vehicle which then proceeded to roll over 360 degrees, landing up right on 200 south, 75 feet east of the intersection facing north.  The driver was able to self extricate himself from the vehicle and local fire department personnel treated him on the scene.  The driver reported at the time of incident he estimated his speed at 25-30 mph.  The driver felt that the tank had separated from the bed prior to the event, that caused the vehicle to shift and tip to the right.","The use of all-thread type bolts should be re-evaluated.  These types of bolts are not made of harden material and will routinely fail under minimal stress.  The harden bolts, which attached the bed of the truck to the frame, bent but did not fail.  All equipment needs to be stored securely in brackets or storage bins.  During a rollover type incident these items, which may be located in the cab of the vehicle, will become projectiles that could cause further harm.  External pumps need to be adequately secured to ensure they will not break free during accidents.  Follow manufacturers recommendations when installing pumps.  Vehicle maintenance checks should be routinely performed and recorded to ensure safe equipment operation.  Routinely check all mounting brackets and bolts for tightness and cracks.  Replace bolts that show any signs of weakness.  Ensure that all vehicles have properly working seat belts, and that drivers wear seat belts at all times.  Implement a drivers education program, and make sure all operators are proficient in operating all equipment.    This incident was thoroughly investigated by numerous agencies. The point of this SAFENET is to remind all that equipment failures can occur at any time or any place.","08/20/2003 00:00"
