"ID", "SAFENET ID", "Iteration", "Event Start Date", "Event Stop Date", "Incident Name", "Incident Number", "Event State", "Event Jurisdiction", "Event Local Unit", "Event Position Title", "Event Task", "Event Management Level", "Event Resources", "Event Incident Type", "Event Incident Activity", "Event Incident Stage", "Contributing Factors", "Human Factors", "Other Factors", "Narrative", "Immediate Action Taken", "SAFENET Create Date"
"24305","5PHPMTSAFE","2","07/13/2003 22:00"," ","TOBIAS FIRE","G090","ID","USFS","Salmon BLM","Engine Boss","Structure Protection","3","Type 4 Engines","Wildland;","Line;","Extended Attack;","Fire Behavior;","Decision Making;","","On July 12th 2003, we were assigned to initial attack a fire up the Tobias creek drainage.  On our second shift we experienced extreme fire behavior and many of the resources were pulled from their suppression efforts to partake in structure protection.  Due to the lack of resources and the many structures that were threatened, fire engines were stretched pretty thin.  Toward the end of our duty day we were briefed on a tactical assignment involving four type 4 engines and two type 6 engines and our assignment was to complete both direct attack and a burnout operation to secure the fireline that was approaching several structures.  After conversing with the other engine bosses, I found out that many of them, including myself, were approaching the DOT CDL duty day driving limitations (15hrs).  I then informed the Operations Section Chief of this problem.  We then came to the conclusion that we would try to get as much done as possible, while trying to leave enough time to get back to ICP.  Which, in turn, led to one of my engine drivers exceeding the duty day limitation by about 15 minutes.  At no point and time did I feel that the fatigue of my engine driver was a safety issue, but I just wanted to bring this out in the open.  When structures are threatened people tend to lose sight of the driving constraints put on us by the state CDL requirements, and in the eye of the public people may be persuaded to bend the rules.","When overhead sets a time for the morning briefing, it might be beneficial to them if they would stagger start times for all engine drivers requiring a CDL and have someone scheduled to brief the engine crews that come on later.  And all engine bosses should go through the chain of command in letting their supervisors know when their drive time expires for the evening.","07/16/2003 00:00"
"24382","5PGMESSAFE","2","07/13/2003 12:30"," ","DUTY STATION","X","TX","FWS","x","Afmo","Changing Truck Battery","3","Equipment","Wildland;","Readiness/Preparedness;","Other;","Human Factors;","Decision Making;Situational Awareness;","none","I was changing a battery on my GOV truck. While holding the wrench in my left hand removing the negative battery cable, I touched the positive battery terminal with my ring on my finger.  It arced and I received 2nd and 3rd degree burns encompassing my finger.","Remove ring before working on a battery    Remove ring before working on a battery and/or use gloves.  PPE","07/15/2003 00:00"
"24388","5PXNTSSAFE","2","07/13/2003 00:00"," ","OVEN FIRE","","CA","NPS","","Fuels Specialist","Fuels Sampling","4","Drying Oven","Fuel Treatment;","Support;","Non-incident;","Equipment;","","","We had a fire in our fuels drying oven about three weeks ago.  The employee who collected the samples brought the oven up to temp., loaded it with samples and left them to dry overnight.  The following morning, our engine bay was filled with smoke as the oven ventilated smoke from the top.  The fire was confined to the interior of the oven and did not involve the building.  When we contacted the manufacturer, we were told that the oven needed to be decontaminated, and shipped back to their factory at our expense (somewhere on the order of $350.00).  Additionally, the manufacturer charges a $150.00 'evaluation fee' to determine if in fact there is anything wrong with the equipment, that fee being applied to any repair costs.  It remains to be seen if the manufacturer will pay the return shipping costs after repairs or how much the repair will cost. The oven is a 3.5-year-old Precision model 45EM, out of warranty for 2.5 years.","Will follow up on this as soon as I get more info from Precision, if you are using these ovens would suggest calibrating the thermostat prior to drying samples.    Oven has been taken out of service.","07/30/2003 00:00"
"24391","5Q6QS6SGAE","2","07/12/2003 00:00"," ","CRANE PARK FIRE / TENDER FOOT FIRE","","CO","BLM","CO-WRF & CO-GJD","Crwb / Fft1 / Ict5","Check-In, Dispatch, Initial Attack, Extended Attack","3","Bighorn Basin Type 2 Ia Handcrew","Wildland;","Line;","Initial Attack;Extended Attack;Mop Up;","Other;","","Lack of training and qualifications","The individual in question was dispatched by Cody Interagency Dispatch Center as a qualified FFT1 / ICT5. The individual joined up with the Bighorn Basin Type 2 Initial Attack Hand crew, having come from the BIA - Wind River Agency. Upon check-in at the Crane Park Fire, the individual was surprised to find that his red card showed him qualified as CRWB. Four days later, after the individual IC'd a Type 5 incident, it came to my attention that he did not have ICT5 on his red card. I found that he lacked knowledge of fire paperwork, dispatch, radios, and initial attack tactics.","I provided the individual with a performance evaluation showing the deficiency I had documented. I will also be mailing the evaluation to the home agency, dispatch center, and regional BIA office. I recommend that the home agency be investigated to ensure that all agency training and qualification standards are being met.","08/06/2003 00:00"
"24307","5PKQ8MSAFE","2","07/11/2003 12:38"," ","BULLDOG","Q632","UT","BLM","","Air Operations Branch Director","","2","Aircraft, Line Personnel","Wildland;","Line;","Other;","Communications;","Decision Making;","","The Bulldog Incident was assigned an Air-Ground frequency of 167.950.

On July 11th, Incident Communications was advised of frequency interference with an incident in neighboring Colorado.  The Communications Tech called the Communications Duty Officer, (CDO) at NICC, and was given a frequency of 169.200 and also was told it would be easier for our incident to change frequencies. Shortly thereafter the Incident Comm Tech sent a General Message form to Air Operations, advising him of the frequency change and to release the previous frequency, 169.950, to the CDO.  After assessing the level of both air operations and line activity, a joint decision (Ops and Air Ops) was made to make the frequency change at this time.  This was facilitated through the airborne Air Tactical Group Supervisor.  Later during that day, the Comm Unit Leader received a General Message Form advising him that 169.200, the new frequency, was the same as on the North Kaibab, with bleed-over problems. No further action was taken.","","07/18/2003 00:00"
"24377","5PBLCDSAFE","2","07/08/2003 17:00"," ","DAILY OPERATIONS","","MT","USFS","Lolo NF","Engine Foreman","","4","Type 4 Engine","Wildland;","Readiness/Preparedness;","Other;","Equipment;","","","While performing end of the day walk around on our new type 4 engine I noticed a leak coming from the rear of the engine.  Upon further investigation the leak was gas coming from the new style pump gas tank.  The rear most weld had cracked at some point during the day.  I had checked some fires and done a little patrolling during the day but had not been on any excessively rough road.  I was able to drain most of the tank using the drain screw but had to remove the tank from the engine to totally empty the tank.  There was no fire but the potential was high for an accident.  The next day we took the engine to the engine shop and they stated they had had some problems with other tanks cracking in the same spot.  The new tank they gave was an old tank that had the same problem but had been refurbished for service.  This tank has a trapezoidal shape from the side and is mounted under the steps that lead to the top of the engine.  The gas line is braided steel and connects to rubber about half way across the tank. If you have a new type 4 engine with this style of tank I would get the tank replaced immediately or at least have it inspected for cracks or weak spots in the welds.","","07/10/2003 00:00"
"24379","5PBW5PSAFE","2","07/08/2003 13:30"," ","DAVIS FIRE","OR-DEF-345","OR","USFS","Def","Firefighter","Mop Up","2","Crew","Wildland;","Line;","Mop Up;","Human Factors;","Leadership;Risk Assessment;","","While assigned to fire suppression activities, specifically mop-up, we became aware that there were several contract engines assigned to mop up division.  Also assigned to division were several Hotshot crews and a faller team with falling boss.  During mop-up activities we became aware that some of the contract engines were felling trees and using power saws in situations that were not 'Emergency' in nature.  When brought to the attention of the STL, I was basically told to mind my own business or I could face the possibility of not being invited back to fight another fire on the district.  The reason for my concern was the contract engine crew was not utilizing safe actions when felling trees, and bucking logs.  The contract crew was not advising other mop up resources of actions they were taking that could affect others working in the area.  It also became aware that some of the felling operations were more recreational than necessary.  I was led to this finding by some of the tree stumps that were left were green with little or no fire damage.","A very simple corrective action already exists, when an out-of-policy event is taking place STL's and above should take immediate action to correct unsafe practice and not belittle crews that are bringing up unsafe or out-of-policy actions.    I contacted STL who was in charge of individuals involved.  Although the STL was not a USFS employee, a USFS employee was in the vehicle with the STL who could have dealt with the issue.","07/10/2003 00:00"
"24374","5PAMF2SAFE","2","07/08/2003 02:30"," ","HOLLAND GULCH","F128","ID","BLM","LSRD","Duty Officer","Set District Response Prioritys","4","2 Engines, 2 Dozers","Wildland;","Transport to/from;","Initial Attack;","Human Factors;","Decision Making;Leadership;Risk Assessment;","Red Book CDL policy conflicts with 2:1 work rest policy","On 7/7/03 at 2200, I received a call from dispatch about a fire in the northern part of the district.  The fire was started by lightning and reported by the lookout to be 1/4 acre in grass and some brush.  Due to fire activity over the 4th of July weekend, we did not have any crews on day off.  Our IA crews started at 0900 and went off at 2000 with no activity.  Because of Red Book CDL duty day requirements, at 2200 the engine crews (7136, 7137) only had 2 hours of CDL driving time left.  By the time the crews were mobilized they would only have time to drive to a staging area near the fire, so they could bed down to meet the required 8 hours off (BLM manual 9210.)  The engines were instructed to bed down by 2400 (the end of their 15 hour duty day) and be up at 0800.  Three additional engines (7140, 7141, 7142) were instructed to come on at 0400, to meet the required 8 hours off, and be available if the fire grew in size.  At 2400 on 7/7/03, Engines 7136 and 7137 bedded down at a staging area away from the fire.  The lookout reported the fire at 1/2 acre and not doing much.

At 0230 on 7/8, I received a call from dispatch that high winds had hit the fire and it was now 100 to 200 acres and threatening structures.  The rurals were asking for assistance.  I instructed dispatch to wake up 7136 and 7137 and send them to the fire.  This violated the Redbook CDL duty day requirements.  I returned to dispatch and sent two additional dozers; another violation of Redbook CDL duty day.  At 0300 I sent a Type 3 IC (from the Helitack crew) who had been on day to the fire.  At 0400 we sent Engines 7140, 7141, and 7142.

After establishing unified command, the IC requested a helicopter, an additional engine, and a Hotshot crew in addition to the 5 engines on scene from the rural fire department.  By this time it was 0600 and all resources meet rest requirements.  No structures were lost; the fire ended up being 393 acres.  Engine 7136 and 7137 were released and in quarters by 1400.  Well within the 2:1 initial attack exemption.

Safety issues

Violation of CDL duty day by engines and dozers.

Delaying initial attack to comply with CDL policy.  By adhering to CDL policy I delayed initial attack of a 1/2 acre fire, which probably could have been handled by 2 engines before the winds hit at 0200. Delayed initial attack caused the fire to grow, threatening structures, and requiring more personnel to suppress the fire. Thereby putting more people at risk.","CDL policy regulations need to be in line with work rest guidelines.

If CDL policy stays the same, we will need additional funding to staff a second shift for our engines.  Current policy effectively cuts our engine workforce in half.  We could order in severity engines to supplement our workforce so that we can staff a night shift.

We are not funded or staffed appropriately to implement the CDL policy as it currently stands.    We have tried to solve the problem by staggering shifts, not calling in resources during red flag periods or for extended staffing, so that we will have crews with fresh duty days if we get a fire.  Basically we are doing the opposite of what our staffing plan calls for during periods of high fire danger.  Crews that have been on standby for an 8-hour day are almost worthless if you get any initial attack after they have gone off shift.","07/09/2003 00:00"
"24381","5PFS54SAFE","2","07/07/2003 15:00"," ","NON-INCIDENT","NON-INCIDENT","NM","USFS","Magdalena RD , Cibola NF","Engine Captain","All Tasks","1","All","All Risk;","Line;Support;","Non-incident;Other;","Communications;","","","On July 7,2003, at approximately 1404, the Cibola NF experienced problems on the Forest Net Channel 1 (171.450 tx and rx).  The Forest heard Mexican Descent persons talking in the Mexican language on this frequency.  This has happened in the past and reported but it had just seemed to stop for a while.  We have had the Border patrol by and asked questions but it seems to keep on happening.  This cuts into some of our fire operations and aviation operations and is a big safety concern of everyone on the Forest.  The lookouts have to keep two radios on to make sure they have another frequency on priority so that they are not getting cut off of Ch. 1.  As of July 14th they are still continuing to use this frequency.","This is self-explanatory. This is a communication safety issue.    There has been a number of SAFENET and SAFECOMs done on this issue.

I also know that the Border Patrol has been notified and has come by the Magdalena RD to ask questions.","07/14/2003 00:00"
"24303","5PHLXQSAFE","2","07/07/2003 13:30"," ","DRY LAKE COMPLEX","NM-GNF-033","NM","USFS","Wilderness RD","Air Tactical Group Supervisor","Air Tactical Supervision","2","Heavy Helicopters, Crews","Wildland Fire Use;","Line;","Extended Attack;","Fire Behavior;Human Factors;","Decision Making;Leadership;Risk Assessment;Situational Awareness;","","I was performing as ATGS on the Dry Lake Fire when contacted by Division B Supervisor.  Fire behavior had increased dramatically (borderline plume domination) in his division to the point where he wanted to use the heavy helitankers that were being deployed at the time in the unstaffed Division A.  He stated a need to 1) protect his ground troops in the area, and 2) try to hang on to a ridge critical to holding actions in his division.  The ground contact would be Division B Safety Officer.

The helitankers had been working in the unstaffed Division A to attempt, without benefit of ground forces, to hold the fire above Turnbo Canyon ostensibly to protect Gila Trout some miles downstream from potential ash flow. They were, at the time, not at all successful in stopping the fire spread and they were operating in marginal conditions due to smoke and turbulence.  I ordered them to Division B based on 1) safety concerns in Division B, and 2) safety and efficiency concerns held by myself and the pilots for their activities in Division A.

Shortly thereafter I was notified by recon helicopter 305 that the Wilderness District Ranger, who was on board, wanted the heavy helitankers moved back to Division A.  My reply was that we would finish out this fuel cycle on Division B due to our collective concerns (myself and personnel in Division B) and then move them back to the unstaffed Division A, conditions permitting (which we did about two hours later).

Top priority given for the fire was SAFETY OF FIREFIGHTERS.  My given priorities (by the Fire Use Team) for helicopter use for the day were:

Priority 1: Stop the fire spread in the Turnbo Creek/Mogollon Creek drainages in Division A to protect Gila trout.

Priority 2: Provide support as requested to Division B.","It has now been demanded by the District Ranger, ostensibly for my actions on 7/7/03, that I be dismissed from my position as ATGS on the Dry Lake Complex.  I will happily do so but have a serious concern that 'Safety First' is taking 2nd priority here to other district concerns regarding this otherwise highly successful Wildland Fire Use fire.  I also will be filing a SAFECOM to the effect that the formidable responsibilities of the ATGS are being compromised here with a DR not working through the chain-of-command to effect a change in operational deployment of aircraft.

The DR must work through the chain-of-command with a positive, constructive attitude that promotes SAFETY as the number one priority.","07/16/2003 00:00"
"24060","5QSR66SAFE","2","07/06/2003 17:00"," ","KINISHBA","AZ-FTA-000198","AZ","BIA","Ft. Apache","Hrsp (T)","Travel","1","","Wildland;","Transport to/from;","Other;","Human Factors;","Decision Making;Fatigue;","","I was dispatched from Alaska to the Kinishba North Zone assignment.  On 7/16/03 at 1715, I arrived at the Phoenix Airport, 11 hours after reporting to my duty station.  The driver arrived more than two hours later from Springerville but could not leave until two more people arrived.  During the time at the airport, I overheard the driver talk on his cell phone about several driving infractions he had and the elk he nearly hit a few nights before.  By the time we left the airport, five hours after my arrival, myself and one of the other passengers had exceeded the 2:1 ratio, but the driver was told by expanded dispatch to bring us to Springerville, AZ.  We traveled from 2200 to 0230 on 07/17/03.  By the time we arrived, the driver had been driving at least 11.5 hours and I had been awake nearly 24 hours.  We were all sleepy driving through a canyon (Sand Canyon I believe), a dangerous drive at night.  After nearly driving off the road, the driver admitted he was not alert as he needed to be, and one of the passengers and I complained about traveling since early the previous morning. The third passenger slept part of the way.  The driver called expanded dispatch, explained the situation and asked if we could be taken directly to where we needed to go (Springerville was a 1.5 hour drive beyond my destination.)  He was told we all needed to report to expanded dispatch first.  When we arrived, we were only asked our name and order number. When we were informed that we would immediately be taken back to our destination, I stated I absolutely could not stay awake to make the drive. Another passenger objected also, and only then were we allowed to suspend travel and stay in a hotel in Springerville.  After 21 hours of travel, I was allowed eight hours to rest before being driven to my destination.

I am concerned about this situation for three reasons:

1) Fatigue: The driver had to drive too long, and the passengers were extremely sleepy because of their length of travel.

2) Driving conditions: It was late at night, on a road through elk country, and through a canyon with hairpin turns and drop-offs of several hundred feet.

3) Disregard of rules regarding travel, e.g. 2:1 work/rest ratios, limits on driver's hours of driving, etc.

I only ask that the responsible party that night consider these reasons before making similar decisions.  The unwavering decision on having us come to Springerville from Phoenix that night could have easily gotten us killed.","","08/26/2003 00:00"
