"ID", "SAFENET ID", "Iteration", "Event Start Date", "Event Stop Date", "Incident Name", "Incident Number", "Event State", "Event Jurisdiction", "Event Local Unit", "Event Position Title", "Event Task", "Event Management Level", "Event Resources", "Event Incident Type", "Event Incident Activity", "Event Incident Stage", "Contributing Factors", "Human Factors", "Other Factors", "Narrative", "Immediate Action Taken", "SAFENET Create Date"
"24371","5P7VDSSAFE","2","06/13/2003 16:00"," ","THOMAS","AZ-ASF-051","AZ","USFS","Alpine RD","Operations Trainee","Burnout","2","Crews, Firing Ops, Aerial Ignition Ops","Wildland;","Line;","Other;","Fire Behavior;Communications;Human Factors;","Decision Making;Leadership;Risk Assessment;Performance;","","The suppression strategy agreed to in the fire delegation to the Eastern AZ Type 2 management team for the Thomas fire was containment of the fire by going indirect and pulling back to trails and natural barriers within the primitive area.  Tactics were to construct line or clear trails and prep for burnout.  Burnout would be accomplished as the fire progressed and approached the control lines in each division.  A firing operation plan and aerial ignition PSD plan was developed to accomplish the tactics.  An addendum made some minor changes to a nighttime hand ignition for DIV D.

The Operation Section Chief Trainee flew to DIV D to discuss the firing operation plan with the crews and overhead.  The Division Supervisor for DIV D, Division Supervisor trainee, and two IHC Supervisors and Crew Foremen met and reviewed the Firing Operation Plan.  All agreed on a nighttime hand firing operation across Paradise Park as stated in the Firing Plan.  This decision was due in part to the torching and profuse short range spotting that had been occurring during previous daytime burnouts due to very dry fuel conditions.  Crews were to strip fire from the north side south to the trail during the evening hours to reduce the amount of mortality that could result from a middle of the burning period ignition.  Personnel on DIV D would start the shift late so that extended shift would not be required for the evening burnout.  A third IHC  would burnout a section of DIV E line down to the DIV D/E break, bed down, and continue burnout and holding operations early the next morning that were not completed from the night before in DIV D.

Two Operations Section Chiefs, the Ops trainee, the Ignition Specialist, and the Incident Commander discussed the next day firing operations and division assignments at the pre-strategy meeting.  There was no talk of aerial ignition in the 2000 acre Paradise Park DIV D area and no changes made to the firing operation plan.  The fact that only inadequate deployment zones existed on the east and west end of the park was the reason that the crews would carry black with them as their safety zone.  To date, the fire was only moving 20-30 chains or less per 24 hour period on a consistent rate of spread.  The fires perimeter was not position to have this kind of combined alignment and was essentially in a backing and flanking posture toward the southern control line for the next 48-72 hours.  I had to leave the fire the next morning on district duties but remained in radio and cell phone contact

On June 13th, I had to leave the fire that morning for district duties but remained in radio and phone contact. The Air Attacks initial morning size-up was that the fire had backed its way off the high rim only on the far northeast end of Paradise Park and continued to back slowly toward the fireline over a mile away.  The IMETS weather forecast was for a weak disturbance to pass through the area early, turning winds more northwest (20 foot winds) 6-10 mph by afternoon and north by evening, then becoming downslope/downvalley 1-3 mph around 2000 hours.  A return to high pressure would follow over the next several days.  The fire behavior forecast from FBAN was fire intensity would be low early in the shift and increase to above the limits for direct attack by hand crews by 1100 hours.  In DIVD, fire would spread toward control line as a flanking fire at 1 chain per hour.  The IAP day operational period for DIV D’s assignment reads “begin burnout from spike camp going west toward Division E/D break and east down to White Oak Springs.  Begin hand ignition ONLY after DIV E has completed their burnout operations.”

At about 1630 a large column developed rapidly with a very distinct cauliflower shaped cap at approximately 25,000 feet above the surface, becoming very dark brown and gray in color.  I called Firing Operations and asked what happened.  He reported that he had aerial ignited several lines down the middle of Paradise Park.  I called the DIV D Supervisor by radio and asked if the fire had made a unexpected run toward the control line.  His response was that the fire had slowly backed toward them during the day but had blown-up after the unplanned aerial ignition was initiated by Firing Operations during the late afternoon on the interior of the park.  The ignition squads that were in place on the interior awaiting hand firing had to hastily evacuate and the crew on the line near spike camp in the middle of park had to hurriedly fire the line, attempting to provide some black as a safety zone.  He estimated 70-80 acre slop-over east of the spike camp due to the plume collapse and that 40-50 percent of Paradise Park had wide spread torching and crowning fire behavior.  The intense plume dominated fire activity was aerial ignition induced by Firing Ops. The Firing plan was not followed by Firing Ops or Ignitions Ops.  The hand firing night operation was changed without prior notice or communicated up and down the line.  The main objective for the incident of providing for firefighter and aviation personnel safety and adherence to the 30 mile OSHA Abatement Plan was not met.  Also, the aerial ignition induced plume dominated fire and subsequent collapse of the column had produced unplanned and unpredicted extreme, erratic fire behavior on DIVD that nearly culminated into multiple injuries or fatalities of 40 crewmembers and 4 overhead personnel.","Persons in Firing Operation positions must make informed intelligent decisions that include a valid assessment of risks related to their actions.  Operation personnel are required to adhere to the standing operational plan until changes are discussed and approved by their supervisor.  Any operational plan changes must be communicated to all overhead and crews, that may be affected, in a timely manner. Operation personnel that ignore, neglect, or intentionally break the 10 STANDARD ORDERS and/or the OSHA 30 MILE ABATEMENT PLAN must be held accountable for their actions.    Recommended to the line officer that the firing operation incident in question and personnel involved needs to be studied further.  The study should include similar past situations of the involved personnel and their performance that have possibly resulted in other near miss and close calls that were overlooked because there was no major injuries or fatalities.","07/06/2003 00:00"
"24362","5NUSH6SAFE","2","06/13/2003 12:00"," ","THOMAS","AZ ASF 301","AZ","USFS","Alpine RD","Firefighter","Burnout","2","Crews, Overhead, Aerial Psd","Wildland;","Line;","Extended Attack;","Fire Behavior;Communications;Equipment;Environmental;Human Factors;","Decision Making;Leadership;Risk Assessment;Performance;Situational Awareness;","","The T2 IMT prepared a Firing Operations Plan and Amendment that included operating procedures (aerial and hand ignition) for all of the divisions.  The burnouts for DIV's A-C that occurred on 6/10-12 were implemented according to the plan.  On 6/12 burnout operations were started on DIV E, but were discontinued due to adverse wind conditions and a check line was constructed to hold the operation until the next day.

On 6/13 the IAP identified that DIV's D&E were to continue and complete their burnout operations.  DIV D was to commence burnout operations only after the burnout was completed in DIV E.  Morning winds were from the southeast-south, but were predicted to move to the west-northwest by mid-afternoon.  Fire behavior was predicted to intensify by mid-day.  DIV D was to be ignited along the control line (southern end of fire) in the evening, but only after the burnout in DIV E was completed. Escape routes were planned for and safe areas on the sw and se were identified (based on hand ignition along the control line).

DIV E tried to conduct their burnout, but shut down on several occasions due to adverse winds and spotting across their control line.  They finally stopped burning once and for all at about 1530.  At some point the morning of 6/13, overhead personnel decided to aerially ignite along a ridge north of the DIV D&E control line.  Aerial ignition operations laid down at least 5 lines of ping-pong balls north of the DIV D control line on a south facing aspect with ponderosa pine and brush fields.  During mid-afternoon ground forces conducted test burns on the sw and se corners along the control line.  A massive 20,000+ foot column built (from the aerial ignition operations) and rolled over, possibly due to the wind shifting to the west, forcing ground units to strip light along the control line to allow time to pull back to their designated safe areas.  The planned burnout in DIV D, with 5 days of preparation by ground forces, most likely would have met the desired objectives; backing fire, understory burn, minimum impact suppression tactics, etc., however, the overzealous aerial ignition caused approximately 85% mortality over 1800 acres of old-growth ponderosa pine and caused a situation that could have caused mortality for approximately 45 firefighters.

There was a lot of confusion, lack of communication, non-adherence to the plans of action, disregard for anticipated weather and fire behavior conditions, lack of situational awareness, and loss of control by the firing operations section chief.","Develop a plan of action; ensure that all personnel are aware of the planned actions and what their role is. Implement the plan considering predicted weather conditions and current and expected fire behavior. Monitor the execution of the plan and mitigate or change tactics as fire behavior, weather, or topography becomes adverse to the plan.  Communicate all deviations from the plan and ensure that all involved personnel are aware of changing conditions.  Ensure that a competent individual is in charge at all times; someone with good communication skills, someone that understands fire behavior, someone that takes pride in being able to execute a plan according to the prescription, someone that maintains situational awareness, someone willing to take control when everything goes to hell.  It does not do any good for all of the leaders to be passive players. COMMUNICATIONS UP THE LINE AND BACK DOWN! 

Basically, adherence to the 10 Standard Fire Orders and 18 Watchout Situations would have gone a long way in making sure that the operation was successful.","06/25/2003 00:00"
"24354","5NLVFFSAFE","2","06/12/2003 16:00"," ","ROLLAND","NV-CCD-000852","CA","BLM","Carson City District","Engine Module Leader","Mop Up","3","Type Six Engine","Wildland;","Line;","Mop Up;","Communications;","","","My engine was assigned to mop-up duty on the Rolland fire. We were in steep terrain and lost radio communication frequently on our Racal handhelds.  Other crews that were working with us and nearby had no communication problems with their King handhelds.  We had to stay attached to other crews that had King radios at all times to keep communications.","If we had access to King radios on our district it would greatly help communications.    I have talked to my supervisor and they agree that the Racal handhelds are a problem. I have also spoken with the district radio technician and he feels that the Racal handhelds do a sufficient job.","06/17/2003 00:00"
"24363","5NVPZLSAFE","2","06/12/2003 15:00"," ","THOMAS FIRE","AZ-ASF-000051 P30150","AZ","USFS","A-S NF","Gila Ihc Superintendent","Line Burn Out Operations","2","Ihc Crews","Wildland;","Line;","Extended Attack;","Fire Behavior;Human Factors;","Decision Making;Leadership;Risk Assessment;Performance;Situational Awareness;","","Our IHC was working Div E on June 12.  Our mission was to bring fire along a razorback ridge to Division D. It was made perfectly clear by the Operations Trainee, from the previous 5 days briefings, that there was no hurry to finish this operation.  It was also made perfectly clear that the forest did not want fire into Grant creek, which was the drainage immediately to the south of the ridge we were to burn.  It was my understanding that once we commenced the burn operation, an aerial ignition was to occur in conjunction with our operation to burn a bowl out.  This was to reduce the risk of running major fire into the bowl and thus reduce tree mortality.  The conditions were not conducive to burn early in the shift.  This was relayed to Operations.  At 11:30 AM we realized that Operations was in an aerial platform leading the ping-pong machine in a burn operation.  They laid a row of fire along the rim of the bowl we were to burn.  We relayed to Ops that conditions were not good for burning.  The winds were blowing across our lines and we didn't think we could hold the fire on the ridge.  Ops said they would generate some heat to pull the fire in.  We told him we did not want to burn at this time. He pressured the DIVS Trainee numerous times (over 3) to burn down to H1 which was located at the end of the ridge before it bailed off down an extremely steep slope into Div D.  The DIVS Trainee then asked me if this was a safety issue.  I answered it was not, it was a spotting issue.  Why all of a sudden were we in such a hurry to burn this after being repeatedly told to go slow?  After intense pressure from Operations, the DIVS Trainee asked me to commence the burn.  I went on record as saying this was a very bad idea and that I didn't think we could hold the line.  The DIVS Trainee did an excellent job of relaying our (his and mine) concerns to Ops but it seemed that Ops was determined to burn. After we commenced the burn, Ops went into Div D and commenced an aerial ignition.  They generated so much heat that a plume-dominated event was occurring.  At that point it was determined we had better check our burn because bad things were about to happen in Div D.  The column collapsed on Div D and blew out between another IHC.  We had predicted north winds that day.  The fireline was south of the firing operation on a south-facing slope of ponderosa pine.

There was no leadership to be found from Operations that day.  It was some of the worst decision-making I have ever witnessed.  Risk assessment and situational awareness were nonexistent.  Operations was reckless with a cavalier attitude that could have killed over 20 people.","If we had followed the plan and not hurried the burn this NEVER would have happened.  

If Ops had listened to his resources on the ground and heeded their advice this NEVER would have happened.    The DIV E DIVS Trainee told Ops many times we could not burn at this time.  I offered input constantly to try and sway Ops to not burn to H1.

This SAFENET needs to be forwarded to Jerome Macdonald, Region 3 Safety Officer.  I have talked with him and he is awaiting this document.","06/26/2003 00:00"
"24351","5NESTYSAFE","2","06/08/2003 01:53"," ","MM-145","NV-CNC-0025","NV","Other","nv-wid","Fire Prevention Officer","Fire Investagatior","4","Pick Up Truck","Wildland;","Transport to/from;","Demobe;","Human Factors;","Decision Making;Fatigue;","night operations","Upon parking and walking away from a government pick-up truck, the operator of the vehicle did not set the parking brake or put the vehicle transmission in “Park.”  This action resulted in the vehicle rolling backwards approximately 40 feet, crashing into a steel post protecting an electronic gate opener. Estimated damage to the vehicle’s right rear bumper and fender is $1000. The safety concern I have is when getting called out late at night to respond to an incident, you must be rested, alert and think clearly about what you are doing. This includes returning to the station and parking.  You must not be in a hurry to get in your personal vehicle and go home.","We talk about safety everyday at morning briefing, some people seem to have more things on their mind rather then concentrating on the job at hand.  The attitude 'sh*t happens' needs to be changed to 'sh*t can be prevented.”  Emphasize that drivers of vehicles will be held accountable for damages. Nighttime operations are more dangerous and extra awareness is needed. Watch for a trend in all individuals’ safety records past and present.  Some people have more accidents than others.  Consider a mandatory 30-day suspension of a person’s privilege to drive government vehicles pending investigation of an accident.    By using this SAFENET and making employees aware of the accident, what happened, how, why. Make it mandatory that all vehicles use chock blocks.","06/11/2003 00:00"
"24350","5NBV8WSAFE","2","06/07/2003 11:30"," ","RECON","","AZ","BLM","PHD/IGM","Firefighter","Recon Flight","4","Helicopter","Wildland;","Transport to/from;","Initial Attack;","Communications;","","","On 6-7-03 the weather was warm and partly sunny with thunderstorms building to the east.  Temps were around 90 degrees with the wind out of the south-south west. At approximately 1130, H-332 left Kingman airport with 4 onboard to conduct a recon flight to look for lightning caused fires in the Music Mountain area. During the flight, radio communication between Phoenix dispatch and H-332 was constantly broken and the 15 minute check-in was not being adequately accomplished. H-332 contacted engine 241, who was patrolling in the area, with clear communication to relay to Phoenix Dispatch of their status. Upon this initial contact with E-241, Dispatch received the transmission between the helicopter and the engine clearly. H-332 continued to flight follow with E-241, who relayed to Dispatch of the helicopters status. After the recon H-332 returned to the Kingman Seat Base, the radios in the helicopter were checked out again and nothing was found to be wrong. On the next flight to the same area there were no troubles contacting Dispatch through the course of the entire flight. This raises a safety issue that if E-241 were not in the area the 15 minute check-in would have been compromised.","This is a reoccurring problem throughout the Phoenix-Kingman fire management zone that is a continued safety issue that should be addressed as soon as possible.","06/07/2003 00:00"
"24349","5NBQS5SAFE","2","06/06/2003 15:30"," ","WORK CAPACITY TEST","","SC","BIA","Eastern Nevada Agency","Firefighter Candidate","Arduous Pack Test","4","","Work Capacity Test;","Readiness/Preparedness;","Other;","Environmental;Human Factors;","Fatigue;","The Individual received and passed/cleared the appropriate Fire Physical by a Health Care Professional prior to the Arduous Pack Test. Included in the Physical was the completion of the current BIA required questionaire indicating no prior problems.","An individual taking the Arduous Work Capacity Test was not able to finish due to heat exhaustion and/or possible seizures. The individual collapsed to the ground and exhibited the signs of those findings. The EMT on scene immediately went to the assistance with a medical kit and oxygen bottle/mask setup. While the EMT was administering medical assistance the call went in to 911 for an ambulance to respond to the location. The ambulance and fire department arrived within five minutes, treated the patient on scene, and transported to the local hospital for a full examination, with the finding being those mentioned above. The individual was released the same day. The MD report stated that the individual was suffering from prior dehydration and will not be able to take any of the Pack Tests in the near future.

A possible environmental concern would be the time of day that the pack test is taken. However the pack test is administered in a variety of times and weather conditions throughout the region, so we rely on the administrators to use reasonable judgment and not go to questionable extremes. In the case of this accident/incident the weather was in the mid 80's with light wind and partial cloud cover.

Potential issues are the quality and accuracy of the fundamental physical being given this year, and the question of the individual’s ability to judge sensibly their own condition, due to possible self-destructive habits, injuries, and other limitations that could be forthcoming. The program seems to suffer when there are those that are not responsible.","A detailed health screening process whereby the person being considered for the Pack Test would have to show they are physically and mentally prepared by listing references to be contacted. Once these references confirm the Positive/OK screening process, the individual would be allowed to continue in the program and take the appropriate Work Capacity Test.    By filling out the SAFENET it is my hopes that the people in a position to evaluate, credit and mitigate the possible solutions to this issue will implement them if there is justification.","06/08/2003 00:00"
"24348","5N7RF5SAFE","2","06/04/2003 13:00"," ","OR-BFZ-2057","OR-BFZ-2057","OR","State","","Asst Center Manager","Trying To Contact Personnel To Send To Incident","4","Engines","Wildland;","Line;","Initial Attack;","Communications;","","","While trying to send resources to a fire, we are unable to use frequencies on that particular land base because of a dysfunctional repeater. The radio system on the formerly known district of Snow Mtn RD (Ochoco NF) now combined with the Emigrant RD of the Malheur National Forest. This System is out-dated and we have experienced problems in the past during times of heavy fire load. Radio Shop is aware of the problem, and they keep trying to fix, but are unable to accomplish due to out-dated equipment. This solution of trying to get by is unacceptable. System needs to be upgraded and fixed properly to ensure safe communications between dispatch and the field going personnel.","Replace existing equipment with a system that will work on a regular basis, so that employees can communicate into dispatch.","06/04/2003 00:00"
"24347","5MZLEASAFE","2","05/27/2003 14:00"," ","BOILER WILDLAND FIRE USE","NM-GNF-003","NM","USFS","D-2","Engine Boss","Traveling From Boiler Fire To Work Station","3","1 Type 6 Engine","Wildland Fire Use;","Transport to/from;","Other;","Equipment;","","","A Type 6 engine with no water was traveling on a dirt road from the incident to the workstation. Due to erosion over the past years the road contains a few ruts. The engine proceeded slowly over the dirt road when the folks came across the first rut. The crew drove in first gear over the first rut, when a sound came from the back of the truck. The crew looked back at the engine and did not notice anything out of the ordinary, so they continued to drive on. The crew then proceeded to drive over the second rut when the second loud sound came from the back of the truck. Due to the tightness of the road the engine driver decided to find a level spot to pull over and investigate the sounds coming from the back of the vehicle. The crew then noticed that on the passenger side the bed had slipped off the frame 3-4 inches. The engine is a 1995, F-350 diesel, model 20, with an aluminum bed and small wood supports between the bed and the frame. Due to the age of the vehicle and how it was constructed the aluminum welds broke on the passenger side causing the bed to come off the frame 3-4 inches.","After investigating the situation, driver error was found not to be a factor. A thorough inspection could have been completed on the engine but may not have resulted in the detection of the broken welds. If this type of engine could have been constructed in a better more stable fashion the bed might have not came apart.    To resolve the problem a welder was brought up to the station to fix the mishap. The boards that support the bed off of the frame will be replaced with 2x2 metal square tubing, and additional bed to frame supports will be installed. I recommend that folks with these types of engines give a thorough inspection of their aluminum welds and the wood boards that separate the bed from the frame","05/29/2003 00:00"
